opinion,sujet,checked_text
Défavorable," Contre le classement des espèces en ESOD, le 17 juin 2023 à 15h18","Contre le classement des espèces en ESOD. Ce classement est un non-sens écologique. A l’heure où l’on comptabilise la disparition de millions d’oiseaux et de nombreux mammifères, chaque espèce a un rôle important à jouer dans l’écosystème et y a toute sa place. Pour exemple, je ne citerai que le renard qui est un allié parfait pour les agriculteurs car il consomme une grande quantité de petits rongeurs. Le geai est également une aide précieuse pour les forestiers, car il transporte beaucoup de glands et contribue à la régénération naturelle de la forêt. Il faut changer les mentalités et arrêter cette suprématie de l’humain qui se donne un droit de vie et de mort sur chaque espèce…..On voit dans quel état cette façon de penser a mis notre mère nourricière la Planète. Il est grand temps de changer les choses et aux services instructeurs de ne plus se laisser influencer par une poignée d’individus qui ne pensent qu’à tout détruire !,Sophie Chiche ri-Nitot"
Défavorable," Non a la classification des espèces nuisibles, le 17 juin 2023 à 15h18","Non a la classification des espèces nuisibles. Vivant à la campagne je constate beaucoup plus de nuisance liées à la diminution des prédateurs belettes, renard, etc. Que l’inverse, on constate une prolifération des campagnols des champs et terrestres ce qui diminue nuits au développement des plantes et des jeunes arbres. Bien que tous les animaux ont leur rôle à jouer dans les écosystèmes. Le renard permet aussi de réguler certaines maladies comme la borréliose (lyme) en diminuant les proliférations de rongeurs, vecteurs de transmission des tiques.,Et encore pleins d’autres raisons de laisser du répit à ses animaux qui sont utiles a leur écosystème."
Défavorable," Il faut d’abord écouter les scientifiques, le 17 juin 2023 à 15h18","Il faut d’abord écouter les scientifiques. La décision est politique, elle n’est pas scientifique. Les CDCFS ne sont pas représentatifs des intérêts en présence, ce sont des modèles de conflits d’intérêt compte tenu de leur composition. Dans ce qui est avancé, aucune donnée n’est validée, la démarche est seulement à charge et les données biologiques sont ignorées : on ne compte que les dégâts causés et pas les dégâts qui sont prévenus. D’un point de vue comptable c’est strictement aberrant, puisque cela revient à comptabiliser les dépenses mais pas les recettes."
Favorable," pour, le 17 juin 2023 à 15h19",pour. Il faut les régulés
Favorable," Pour le projet d’arrêté , le 17 juin 2023 à 15h15","Pour le projet d’arrêté . Je suis pour c’est arrêté,vu les dégâts que subissent les agriculteurs. Il faudrait même y mettre d’autres espèces."
Défavorable," Non au massacre des animaux sauvages, le 17 juin 2023 à 15h19","Non au massacre des animaux sauvages. NON à cette hérésie, qui ne prend aucunement en compte la place essentielle occupée par tous ces animaux dans les écosystèmes, tout en faisant l’impasse sur les mesures alternatives à la destruction, dont l’efficacité est pourtant largement démontrée !,,De plus il est urgent d’étudier le cas de chaque région.,Écoutez les préconisations des scientifiques.,Stop aux massacres"
Défavorable," Contre ce projet, le 17 juin 2023 à 15h20","Contre ce projet. Le renard est précieux pour limiter la population de campagnols.,La nature sait s’auto réguler si on lui en laisse la possibilité !,Effectivement, quelque poules sont victimes de prédateurs mais avec quelque procédés simples on diminue les risques : rentrer ces animaux dès le soir dans un abri bien clos, prévoir un filet aérien ou des arbres dans leur parc pour gêner les attaques de rapaces…,Acceptons que chaque espèce trouve une place raisonnable dans la chaîne alimentaire."
Défavorable," RESPECTONS LA BIODIVERSITE, le 17 juin 2023 à 15h20","RESPECTONS LA BIODIVERSITÉ. Je suis contre ce projet d’arrêté fixant une liste des espèces susceptibles d’occasionner des dégâts. Car c’est bien cela, elles sont ""susceptibles"" pas forcément coupables. Et on va les détruire, au cas où…J’habite au Pays Basque, et depuis quelques années, je ne vois presque plus de pies, malheureusement je comprends mieux pourquoi. ,Chaque espèce a son rôle dans la nature, et sans l’intervention de l’homme, la régulation devrait se faire naturellement. Or, qui a le plus bouleversé les écosystèmes ? L’être humain sans aucun doute. ,Je réitère mon opposition à ce projet. RESPECTONS LA BIODIVERSITÉ ! et trouvons des alternatives pour cohabiter avec toutes ces espèces.,Josiane BARNACHE"
Défavorable," pour qui on se prend , le 17 juin 2023 à 15h20","pour qui on se prend . je trouve sa désolant de dire que tel ou tel animal est un nuisible alors que celui qui nuit le plus a la nature est l homme avec tout son bétonnage , les destructions de lieux naturel sensibles et divers écosystèmes , des forets abattues , de surpêche , de pesticides etc etc etc tellement la liste est longue , nous ferions mieux de laisser la nature reprendre sa place et devrions vive en harmonie avec elle , essayons déja de sauver les espèces animales en voie de disparition , de créer des zones vertes en ville etc etc de nouveau tellement la liste de travail serait longue , au lieu de perdre du temps à pondre a savoir si tel animal est nuisible ou pas alors que le plus grand nuisible de la terre est l humain"
Défavorable," arrêtez-vous quelques minutes, quelques heures, quelques jours…, le 17 juin 2023 à 15h20","arrêtezvous quelques minutes, quelques heures, quelques jours…. … pour sortir au dehors et regarder autour de vous, dans les campagnes, autour des villes, des villages, dans les villes et dans les villages : quelle place est laissée aux vivants de notre planète ? La majorité des espaces est occupée par les humains ou affectée par ses déchets, traitements et pesticides inclus. Il est possible de quo-exister en prenant conscience du rôle de chacune des espèces et de la complexité des interdépendances. Plus de sciences et plus de connaissances afin de comprendre que les équilibres existent et peuvent exister avec les humains mais pas sans les animaux, de surcroît pas sans une liste malheureuse de quelques espèces arbitrairement dénoncées. Je suis CONTRE cette liste, je suis pour une meilleure diffusion des informations concernant les mondes animaux et végétaux et j’espère qu’à tout le moins les conséquences du comportement des humains qui ne font que commencer à se faire sentir finissent par leur ouvrir les yeux sur l’urgence à changer de comportement. Il est tout à fait possible d’être HEUREUX sans toute cette consommation insensée."
Défavorable," contre ce projet, le 17 juin 2023 à 15h20",contre ce projet. Il est temps de réviser des schémas de classement obsolètes face à l’effondrement de la biodiversité et d’adopter une méthode de gestion de la faune plus respectueuse de ces espèces diabolisées dans l’inconscient collectif et dont le véritable impact sur notre environnement est loin d’être ce que l’on prétend ….
Défavorable," NON au classement des animaux nuisibles, le 17 juin 2023 à 15h21","NON au classement des animaux nuisibles. La méthodologie utilisée pour procéder au classement est incohérente et infondée en raison de l’absence de données sérieuses sur la réalité des dommages, bien souvent insignifiants, imputés aux espèces présumées coupables et en l’absence de données fiables sur l’état réel des populations de ces espèces et leur dynamique (notamment concernant les mammifères). ,Le « droit à détruire » des espèces est un non-sens écologique. Les dommages constatés devraient d’abord engendrer des solutions localisées dans l’espace et dans le temps, et non justifier une réponse massive concernant la totalité des individus d’une même espèce, comme c’est le cas aujourd’hui.,Aucune évaluation scientifique n’a été effectuée pour démontrer que les destructions de milliers d’individus de ces espèces permettent de réduire corrélativement les dégâts qui leurs sont imputés.,La pie bavarde ou le geai des chênes sont également accusés de s’attaquer aux œufs et aux oisillons d’autres espèces mais cette prédation naturelle n’est nullement responsable du déclin des populations d’oiseaux, qui est essentiellement dû à la perte d’habitat et la diminution de la nourriture causées par l’artificialisation et l’agriculture intensive.,Ces animaux sauvages jouent un rôle dans le fonctionnement des écosystèmes naturels, notamment sur le plan sanitaire : le Geai des chênes, le Corbeau freux, la Corneille noire, le Renard roux et la Martre des pins peuvent par exemple consommer d’autres animaux malades ou morts, imitant ainsi la propagation de maladies et contribuant à maintenir un milieu en bonne santé. En outre, la prédation des rongeurs par les renards et les fouines permet la diminution du risque de transmission de la maladie de Lyme sur l’homme par les tiques qu’ils véhiculent.,Plusieurs ESOD sont de véritables auxiliaires des activités agricoles et forestières. En tant que prédateurs spécialistes des petits rongeurs (campagnols, mulots…), le renard, la belette, la martre et la fouine permettent de contenir les populations de ces espèces dans les parcelles agricoles. Par exemple, une belette consomme en moyenne NOMBRE rongeurs dans l’année et le Renard roux jusqu’à NOMBRE .,Les corvidés (le Corbeau freux, la Corneille noire, la Pie bavarde et le Geai des chênes) participent également à la régénération de la végétation ainsi qu’à sa diversité en dispersant les graines qu’ils consomment. Le geai disperse ainsi plusieurs milliers de glands chaque année dans la nature, ce qui en fait le premier planteur d’arbres de France !,Des solutions alternatives à la destruction existent et ne sont presque jamais mises en œuvre. Il est ainsi possible de concilier la présence de corvidés et les pratiques agricole s : enfouissement plus profond des semences, meilleure stratification du paysage rural (haies, structures boisées, perchoirs naturels pour rapaces, effarouchement…). Des solutions efficaces existent aussi pour limiter la prédation sur les volailles d’élevage (grillage à mailles étroites suffisamment haut et profondément ancré dans le sol, répulsifs, surveillance…)."
Défavorable," Contre la poursuite des destructions, le 17 juin 2023 à 15h20",Contre la poursuite des destructions. Je suis contre ce projet d’arrêté qui vise à la destruction par l’homme d’espèces qui ont toute leur place dans le vivant. D’autres méthodes existent pour lutter contre les dérangements occasionnés par les ESOD mais ne sont pas suffisamment mises en œuvre.
Défavorable," Participation à la consultation

Projet d’arrêté pris pour l’application de l’article R. 427-6 du code de l’environnement et fixant la liste, les périodes et les modalités de destruction des espèces susceptibles d’occasionner des dégâts, le 17 juin 2023 à 15h15","Projet d’arrêté pris pour l’application de l’article R. NOMBRE - NOMBRE du code de l’environnement et fixant la liste, les périodes et les modalités de destruction des espèces susceptibles d’occasionner des dégâts. Bonjour,,Non à la destruction de tous les animaux qualifiés ( Esod ). ,Tous ces animaux font partie de la chaîne naturel au même titre que l’homme qui pourtant produit les plus gros dégâts sur notre terre.,Toujours vouloir oublier les pouvoirs naturels de régulation des renards, putois, belette, fouine , martre mais préférer le chimique et la chasse.,France pays des lumières tolère encore le piégeage cruel , le déterrage, la col , quelle honte pour satisfaire les modernes divers et variés.,Bref je fais partie des NOMBRE de français contre ce nouvel projet de classement esod pour les NOMBRE année à venir.,BLING-BLING Charles Alsacien du Bas-Rhin fier que dans notre département le blaireau n’est plus chassable."
Défavorable," Je suis contre cet arrêté, le 17 juin 2023 à 15h14","Je suis contre cet arrêté. Je suis contre la destruction du vivant et ce projet issu de la prétention d’un humain qui n’a toujours pas compris que la nature se régule mieux que lui peut le faire. On ne compte plus les désastres écologiques que l’homme crée et continue de répandre le message que sans lui tout est déréglé. Concernant les espèces considérées, elles sont tout à fait utiles. Le Renard régule Lyme, Lyme est en pleine expansion. Il n’y a aucun contre argument. Les poules sont bien souvent tuées par des chiens errants, on ne tue pas les chiens pour autant. On ne va pas détruire tout ce qui mange la même chose que nous, ou alors l’être humain est tellement stupide qu’il mérite bien la disparition vers laquelle il se mène lui-même, à grands coups d’arrêtés autorisant les DESTRUCTIONS d’espèces. Nous sommes dans la 3D ère de disparitions massives d’espèces animales et végétales. Il n’y a plus à détruire mais à retrouver les modalités de vie en harmonie avec notre planète. La planète n’est pas faite pour être couverte de béton, de câbles électriques, de centrales nucléaires, et sans animaux. Toutes les études montrent bien l’importance de chaque maillon dans la vie d’un écosystème. Détruire (ha pardon ""réguler"") une espèce c’est déséquilibrer un écosystème qui est plus intelligent que nous. De ce fait, et en connaissance des fonctions infiniment complexes et parfaites d’autorégulation de la nature, je m’oppose totalement à la soi disant prise en charge de la régulation de la nature pour l’homme. NON à ce projet."
Défavorable," Stop à l’écocide, le 17 juin 2023 à 15h13","Stop à l’écocide. Et l’être humain on le classe où? Pour moi il est en tête de la liste des nuisibles. C’est le premier à déséquilibrer et détruire les écosystèmes, totalement contre ce projet !!"
Défavorable," Non aux destructions d’espèces vivantes, le 17 juin 2023 à 15h13","Non aux destructions d’espèces vivantes. en tant que citoyenne française, votante, je tiens compte comme beaucoup aujourd’hui de l’attitude des autorités vis à vis de la faune sauvage. Et je m’oppose à des mesures visant à détruire des espèces soit disant nuisibles, à tuer par des méthodes cruelles, de piégeage, de déterrage etc..des oiseaux, des animaux qui ont un rôle bénéfique pour la biodiversité et l’équilibre écologique : le renard et d’autres se nourrissent des petits rongeurs qui dévastent les cultures, en éliminant les renards on voit les agriculteurs utiliser des produits chimiques polluants pour s’en débarrasser.,Les procédures de classement sont réalisés d’après les données des chasseurs qui ne sont jamais vérifiées et l’on s’aperçoit qu’il s’agit surtout pour eux de se débarrasser d’animaux concurrents pour l’accès au gibier. Les français sont très très majoritairement opposés désormais à la chasse alors que la biodiversité s’effondre partout et que ces chasseurs nous font peur quand on les rencontre dans les chemins le dimanche.,Faisons appel à des scientifiques pour analyser de façon objective la place de la faune sauvage dans notre pays et arrêtons les massacres indignes encore présents dans notre pays !"
Défavorable," Biodiversite, le 17 juin 2023 à 15h13","Biodiversité. La nature est plus armée que nous . l espèce humaine est devenue un pou pour la planète . Elle saura réguler les espèces. Tout etre vivant a son utilité. L un est proie, l autre prédateur. Laissons les renards, blaireaux, et ""autres nuisibles"" faire leur boulot. Laissez les vers de terre vivre et réparer la terre. . Il est grand temps de se réveiller et de réparer ces années folles."
Favorable," POUR, le 17 juin 2023 à 22h58","POUR. Je suis pour la mise en place de cet arrêter car la régulation des espèces est essentielle à l’écosystème et la biodiversité, toutes espèces doit être régulé intelligemment pour l’équilibre et la bonne santé de chacune d’elles ."
Défavorable," Contre ce projet, le 17 juin 2023 à 13h22","Contre ce projet. Lorsque Mao a voulu éradiquer les quatre nuisibles : moineaux, rats, moustiques et mouches, au lieu d’augmenter les récoltes, il a plongé son pays dans une famine sans précédent. Nous savons maintenant que chaque espèce est importante pour la biodiversité.,Aujourd’hui, cette biodiversité est en régression du fait des activités de l’homme. Au lieu de continuer à détruire des animaux il faudrait préserver leur habitat, leur environnement, leurs ressources et arrêter de les empoisonner.,L’urgence environnementale est primordiale. C’est le travail de nos politiques de la faire passer au premier plan."
Défavorable," Ça suffit !, le 17 juin 2023 à 22h16",Ça suffit !. La seule espèce nuisible c’est l’humain… Tous ces animaux ont leur place et leur utilité dans l’écosystème. Pourquoi vouloir détruire ceux auxquels nous n’arrivons pas à nous adapter plutôt que de remettre en question nos outils et nos coutumes ?
Défavorable," Avis défavorable , le 17 juin 2023 à 22h16",Avis défavorable . Ces animaux sont des régulateurs et font partie d’une biodiversité indispensable et déjà en souffrance
Défavorable," Défavorable , le 17 juin 2023 à 22h17","Défavorable . Il me semble complètement aberrant d’autoriser le massacre (le terme régulation est effectivement plus doux aux yeux et aux oreilles et évite ainsi de choquer mais il s’agit bien de massacre) d’espèces qui prolifèrent du fait de la gestion de l’environnement. Comment justifier l’autorisation d’utilisation de produits chimiques pour réguler des campagnols et en parallèle, juste à côté, autoriser le déterrage de renards ? ,Qui « régule » ? Des personnes habilitées et neutres ou des personnes qui prennent plaisir à tuer, persuadées d’être au-dessus de toute vie sur terre et d’avoir le pouvoir de vie et de mort sur autrui ? ,Par ailleurs, je doute qu’exterminer quelques espèces, puisque c’est bien l’objectif de ceux qui pratiquent cet exercice, permettent à d’autres de se développer si l’on ne tient pas compte, en parallèle, de leurs besoins primaires en matière de nourriture et d’environnement…."
Défavorable," Contre , le 17 juin 2023 à 22h17",Contre . Qui sont les vrais nuisibles hein ??? Je suis contre ! Laissez les animaux tranquille c’est nous qui sommes sur leur royaume
Défavorable," Avis totalement défavorable à l’inscription du renard sur la liste ESOD, le 17 juin 2023 à 22h19","Avis totalement défavorable à l’inscription du renard sur la liste ESOD. NOMBRE . L’écosystème évolue aujourd’hui d’une manière très difficile à prévoir ou comprendre (effets, vitesse du changement) avec le dérèglement climatique. Les experts eux-mêmes en sont surpris. L’impact du classement du renard en ESOD pour une période de NOMBRE ans dans ce contexte est totalement déraisonnable. L’action de supprimer des renards est irréversible et porte effet pour de longues années (les NOMBRE ans de classement, plus les années à retrouver une population souhaitée en cas d’évolution défavorable). C’est d’autant plus vrai que pour certaines régions comme l’Auvergne, l’effet du dérèglement climatique sur l’écosystème est très difficile à prévoir (grosses variabilité des paramètres à prendre en compte et des effets). De nombreux experts recommandent pour l’instant de ""laisser faire"" et d’intervenir le moins possible, tant qu’on ne sait pas où on va.,NOMBRE . Par ailleurs, le renard considéré comme nuisible pour certains (élevages aviaires) s’avère un auxiliaire précieux pour d’autres (cultivateurs ou éleveurs bovins ayant subi les ravages du campagnol par exemple). La protection d’un élevage aviaire est aisé à mettre en place (vivant personnellement dans une région où je vois des renards très fréquemment, je n’ai jamais subi de dommage dans mon poulailler, pas plus que mes voisins proches ou un peu plus éloignées). Des aides peuvent être allouées aux éleveurs aviaires afin de mettre en place des protections adéquates. Les dégâts occasionnés par le renard n’ont jamais mis en péril une saison d’activité d’aucun de ces éleveurs.,NOMBRE . Finalement, laisser la ""charge"" de l’élimination, qui est dans la pratique opérée sans contrôle sur ses modalités, à des gens dont on ne vérifie pas leur position vis à vis du respect du bien être animal est totalement irresponsable et indigne. Il suffit de rappeler les actes de grande cruauté commis au cours de déterrages (avec ou sans chien) des blaireaux. Au non de quoi des particuliers dont on ne sait rien peuventils être investis de la charge qu’a l’État de réguler les ESOD ?,,On ne peut pas laisser l’intérêt immédiat de quelque uns porter préjudice à l’ensemble."
Favorable," Favorable , le 17 juin 2023 à 22h19",Favorable . Favorable a cette arrêté on parle de régulation et non d’extermination de ces espèces qui cause énormément de dégâts dans nos campagnes mais sa il faut y vivre pour le voir
Défavorable," CONTRE CE CLASSEMENT "" ESPECES NUISIBLES"", le 17 juin 2023 à 22h20","CONTRE CE CLASSEMENT "" ESPÈCES NUISIBLES"". aucun animal ne doit être classé nuisible,faisons preuve de bienveillance à l’ensemble des animaux cela changerait le monde dans lequel nous vivons , c’est à dire un monde ayant peu d’empathie pour les animaux mais aussi finalement les hommes ,ces espèces ont autant le droit de vivre que nous !,quel droit avonsnous de les tuer ?,aucun ,supprimons le droit de tuer ces animaux"
Défavorable," Non aux arrêtés de destruction des nuisibles, le 17 juin 2023 à 22h20","Non aux arrêtés de destruction des nuisibles. Face à l’action de l’homme si néfaste à la nature, qui peut considérer une espèce animale comme nuisible ? Franchement ! L’action bénéfique des animaux concernés compense largement les dégâts qu’ils peuvent causer. Je suis donc absolument contre ces arrêtés de destruction cachés sous le terme de régulation."
Défavorable," avis défavorable, le 17 juin 2023 à 22h24","avis défavorable. Laissons la nature s’équilibrer seule,Ce sont les activités humaines qui déséquilibrent le vivant"
Défavorable," Consultation publique/ animaux classé nuisibles , le 17 juin 2023 à 22h24","Consultation publique animaux classé nuisibles . C’est criminel aujourd’hui de vouloir encore autoriser la Tuerie de ces bêtes,Renard, belettes etc ."
Défavorable," Marre du lobby des chasseurs…, le 17 juin 2023 à 22h18","Marre du lobby des chasseurs…. …qui s’autoproclament les seuls ""vrais"" ruraux alors qu’ils ne font que véhiculer leur idéologie mortifère à coups de carabines. Merci d’entendre les autres habitants des campagnes, tout aussi légitimes que ceuxlà et majoritaires car plus nombreux mais soumis au silence de l’omerta des petits villages, qui veulent vivre en harmonie dans les éco-systèmes. Les renards chassent un nombre infini de ""nuisibles"". Ils sont beaux. Ils sont utiles. Nous les aimons et n’aimons pas les chasseurs qui nous privent chaque weed en de notre nature, celle qui n’est pas plus à eux qu’aux autres, qu’ils n’aiment pas plus que les autres sous prétexte qu’ils y relâchent des faisans d’élevage et s’y promènent avec des armes. Quand seronsnous enfin entendus ?"
Défavorable," CONTRE ce projet d’arrêté ESOD, le 17 juin 2023 à 22h38","CONTRE ce projet d’arrêté ESOD. Contre cette logique d’un autre âge. L’homme décide de la vie et de la mort d’espèces qualifiées de nuisibles : mesure-on les dégâts réels ? Au contraire, mesure-on les services rendus par ces espèces (régénération de la végétation, prédations de rongeurs au bénéfice des activités agricoles…) ? Nous avons besoin d’écosystèmes fonctionnels dans lesquels les régulations se font naturellement. Je vois NOMBRE espèces concernées dans le Val d’Oise, le renard, la fouine, le corbeau freux et la corneille noire. Je fais souvent de la randonnée dans ce département, en forêt, et je désespère de voir des êtres vivants, la plupart du temps c’est vide. quelques oiseaux, NOMBRE écureuil de temps en temps, je n’ai jamais vu de fouine, de martre, de belette de ma vie, quel regret. Il y a déjà la pression des pratiques agricoles (pesticides, plus de prairies, de friches, de haies), la pression des chasseurs, n’en rajoutez pas encore et toujours. Nous sommes en phase finale d’un effondrement généralisé de la biodiversité, que voulezvous de plus ?"
Favorable," Favorable, le 17 juin 2023 à 22h39",Favorable. Vu des villes il est mignon le Roy de Wall Disney… mais le matin où vous avez NOMBRE poules de tuées par ce mignon Roy et bien vous le regardez d’un autre œil …
Défavorable," ça veut dire quoi, titre???, le 17 juin 2023 à 22h39","ça veut dire quoi, titre???. Défavorable à cette liste, mais foutons la paix aux animaux, bon sang ! A TOUS les animaux ! Pour qui nous prenons nous???"
Défavorable," Non à la liste ESOD, le 17 juin 2023 à 22h39",Non à la liste ESOD. Halte à l’écocide !!! Laissons la nature se réguler par elle-même et arrêtons de satisfaire les demandes du lobby des chasseurs.
