opinion,sujet,checked_text
Favorable," Tourdevazel@gmail.com, le 22 juin 2023 à 20h23",. Nous sommes favorables à vos propositions excepté l’article NOMBRE
Défavorable," Contre la destruction des espèces susceptibles d’occasionner des dégâts, le 22 juin 2023 à 20h23","Contre la destruction des espèces susceptibles d’occasionner des dégâts. Je suis contre la destruction de ces espèces qui ne sont pas nuisibles !!!,,Elles font partie de l’écosystème ,,,Stop aux actes de l’homme le plus grand prédateur et destructeur de la planète !!!"
Favorable," favorable à la régulation des nuisibles, le 22 juin 2023 à 20h24",favorable à la régulation des nuisibles. je suis désolé mais c’est réguler et pas tout détruire ceux qui sont contre devraient en premier aller sur le terrain en second vous devriez regarder autour de vous et là vous dites rien sur l’abattage en série de canards qui ne sont pas malades et plus de ça la maladie ne risque rien pour l’homme des milliers et millets sont tués apres on va faire quoi ????à oui les vaches qui polluent remettez vous en question nous nous régulons vous vous laissez tuer
Défavorable," Contre l’arrêté , le 22 juin 2023 à 20h31",Contre l’arrêté . Cette liste n’a pas lieu d’être. Ce ne sont pas des nuisibles…..
Favorable," Avis favorable en plus de la pie bavarde, le 22 juin 2023 à 20h23",Avis favorable en plus de la pie bavarde. Avis favorable et rajout de la liste de la pie bavarde car très grande prolifération avec beaucoup de dégâts causés
Défavorable," Sans titre, le 22 juin 2023 à 20h31","Sans titre. Je m’oppose au projet d’arrêté ministériel qui classe la Belette d’Europe, la Fouine, la Martre des pins, le Renard roux, le Corbeau freux, la Corneille noire, la Pie bavarde, l’Étourneau sansonnet et le Geai des chênes sur la liste des animaux nuisibles causant des dégâts. Car les dégâts commis sont rarement prouvés, l’efficacité de leur destruction n’est pas démontrée, et que leur importance dans le fonctionnement des écosystèmes naturels n’entre pas en ligne de compte dans votre projet. ,En NOMBRE comment peuton se questionner sur ces sujets. ,Merci"
Défavorable," Avis DEFAVORABLE, le 22 juin 2023 à 20h29","Avis DÉFAVORABLE. Rien que dans le titre de cette consultation, il est dit "" espèces SUSCEPTIBLES d’occasionner dégâts"", donc, il y a autant de probabilités que ces espèces ne causent pas de dégâts !,Le doute ne devraitil pas profiter aux ""accusés"" ?,,Je ne suis ni chercheuse, ni analyste, rien de cela, simplement une grand-mère triste et inquiète pour l’avenir de nos petits-enfants.,En NOMBRE ans, nos paysages, nos forêts, nos campagnes, nos vies ont tellement changé. ,Ne sommesnous pas, nous les hommes, les plus gros destructeurs et les plus cruels des prédateurs ?,Je suis toujours sidérée quand j’entends par exemple qu’un sanglier a traversé une route… N’estce pas plutôt la route qui a coupé la forêt ?,A l’heure où le réchauffement climatique n’est plus une hypothèse, mais bien une réalité, à l’heure où de très nombreuses espèces animales ont disparu ou ne vont pas tarder à disparaître, à l’heure où même les forêts bretonnes ont brûlé,,ne pouvonsnous pas avoir un rôle protecteur, et simplement laisser la vie reprendre, se remettre de tous nos abus, sans interférer, et si toutefois, dans l’avenir, nous sommes (ce dont je doute fort) envahis ou infestés par des renards, belettes ou autres, alors là, prenons tous ensemble de nouvelles décisions.,La dernière fois que j’au vu un renard dans une forêt, c’était il y a plus de trente ans.,Au rythme où nous détruisons tout, les générations futures devront-elles découvrir ces espèces uniquement à travers les livres ?,Laissons à toutes ces espèces la possibilité de vivre, sans être traqués, car oui, ils ont tous un rôle à jouer. ,De plus, à l’heure où tout le pays parle écologie, les centres villes sont de re-végétalisés, la mise en place des ZFE, etc, cette liste ESOD parle de destruction, de tuerie, certaines fois par des moyens d’une autre époque, cette liste donc, pour moi, est en parfaite contradiction avec cette période où il est demandé à chacun de nous de prendre conscience de notre responsabilité, de notre impact sur notre environnement, etc.,Laissons ces espèces vivre, et renonçons à établir cette liste assassine pour notre seul profit, ou plutôt pour le seul profit de certains."
Favorable," NOUVEAU CLASSEMENT DES ANIMAUX ""ESOD"", le 22 juin 2023 à 20h29","NOUVEAU CLASSEMENT DES ANIMAUX ""ESOD"". Un nouvel article (article NOMBRE ) vient d’être ajouté pour limiter les conditions de destruction. Je suis fermement OPPOSE à cet ajout.,En effet, je suis non seulement pour la totalité des propositions de classement et je demande l’ajout de NOMBRE classements supplémentaires qui avaient été demandés par les préfets dans les départements car les dégâts de ces espèces ne sont ni indemnisés, ni assurables, ni facilement évitables. Il ne reste donc qu’à les contenir par la régulation des effectifs des espèces en cause ; ces espèces, notamment renard et mustélidés, sont essentiellement nocturnes et la chasse est interdite la nuit,,L’État lui-même a recours à la régulation destruction de certaines espèces protégées (Loup, Cormoran…) de même que les associations de protection de la nature, et ces prédateurs et déprédateurs commettent des nuisances toute l’année, il faut donc intervenir à tout moment,,De plus, il a été scientifiquement montré que plus il y a de renards, plus il y a de cas humains d’échinococcose alvéolaire, maladie mortelle. Il faut donc contenir l’augmentation des populations de renards,,L’Échinococcose augmente dans les milieux urbains,,Même chose pour les corneilles noires et les freux réalisent de gros dégâts à la période des semis, ces espèces n’ont pas de prédateur et leurs populations augmentent,,Les populations de petites faunes ont considérablement baissé et ne peuvent plus accepter une hausse des effectifs de leurs prédateurs (au risque de totalement disparaître) d’autant que certains sont protégés (buse variable, chats …)."
Défavorable," Avis défavorable à ce projet 22/06/2023, le 22 juin 2023 à 20h28",Avis défavorable à ce projet NOMBRE NOMBRE NOMBRE . Efficacité non démontrée de la nuisibilité de ces espèces qui jouent par ailleurs un rôle important dans l’écosystème
Défavorable," Espèces Susceptibles d’ Occasionner des Dégâts, le 22 juin 2023 à 20h26","Espèces Susceptibles d’ Occasionner des Dégâts. Une refonte de notre rapport à la faune commune , le NOMBRE juin NOMBRE à ,Je demande demande a minima :,– l’interdiction du déterrage du renard à l’échelle nationale ;,– la reconnaissance du rôle bénéfique de toutes les espèces dans les écosystèmes et vis-à-vis des activités humaines ;,– une refonte de la procédure de classement qui est une instruction à charge menée par les chasseurs et dont les données sont invérifiables ;,– l’interdiction de tuer ces espèces pour satisfaire les intérêts liés à la chasse,,– la mise en œuvre obligatoire de méthodes alternatives à la destruction pour toutes les espèces,,– un zonage par espèce prenant en compte les dégâts constatés et la présence d’exploitations agricoles, et l’interdiction de tuer ces espèces en dehors des activités sensibles à leur présence."
Favorable," Je suis favorable , le 22 juin 2023 à 20h28","Je suis favorable . il faut maintenir cette liste des ESOD en l’état et durablement, vu les dégâts que ça occasionne sur de nombreux points. Il es important de ne pas laisser une minorité causée le désordre"
Défavorable," Défavorable , le 22 juin 2023 à 20h27","Défavorable . L’Homme est la seul espèce qui dérègle cet écosystème. En prenant ce genre de décision à la place de la nature c’est nous qui déréglons la planète. ,Ces espèces sont là pour une bonne raison elle font partie d’un tout. ,La planète n’est pas qu’au Homme ,Elle est au vivant"
Défavorable," Contre la liste ESOD et l’arrêté, le 22 juin 2023 à 20h27","Contre la liste ESOD et l’arrêté. Cette liste et cet arrêté ne s’appuient sur aucune mesure scientifique voire objective de dommages prétendument causés par les espèces concernées. Il ne peut donc être décidé de permettre leur destruction sans limite en l’absence de telles données qui, seules, établiraient de manière impartiale une possible nuisance."
Favorable," Vis favorable à la liste des espèces ESOD., le 22 juin 2023 à 20h27","Vis favorable à la liste des espèces ESOD.. Les pies causent d’important dégâts sur les nids de passereaux et surtout dans les villes où il n’est pas possible de chasser. Il faut donc pouvoir capturer cette espèce pour réguler sa population .,Les corbeaux et les corneilles causent d’important problème sur les poubelles des villes et villages. Ces NOMBRE espèces causent également des dégâts aux semis de cultures.,Les fouines causent d’important dégâts dans les combles des habitations dans l’isolation. Un moindre trou leur permet de pénétrer.,Les renards sont également installés dans les banlieues et rodent dans les villages et font également les poubelles. Ils causent des débats dans les élevages de volailles. Ils sont porteurs de l’échinococcose.,Les étourneau ruines par leurs excréments, la peinture des véhicules en stationnement sous les arbres où ils viennent se coucher le soir.,Il est important de conserver la liste des ESOD pour réguler les diverses espèces lors qu’il y a une nécessité.,Ces différentes espèces sont en constante augmentation. Le nombre de chasseur diminue,"
Favorable," Favorable à l’arrêté de juin 2023, le 22 juin 2023 à 20h26","Favorable à l’arrêté de juin NOMBRE . Tout est dit dans le nom espèces susceptibles d’occasionner des dégâts. ,Quand les pseudo écolos se retrouvent avec des dégâts dans leur maison ou appartement il leur semble normal d’éradiquer cafards, guêpes…, pourquoi ne pas admettre qu’à la campagne il en va de même avec les insectes, mammifères ou les ovipares. Ne sont pris en compte que les dégâts agricoles dans les décisions de classement. Quand vous êtes un particulier qui subit les dégâts ( cocotier en ville, cheminée bouchée…voir l’échinococcose alvéolaire, sans parler du reste) la vous voyez le monde animal d’une autre manière ."
Favorable," pour le projet des ESOD, le 22 juin 2023 à 20h26","pour le projet des ESOD. Il est important de pouvoir réguler ces espèces car leur dégâts ne sont indemnisés, ni assurable et ni facilement évitables. Il ne reste que la régulation pour contenir les effectifs de ces espèces. Ces espèces, notamment renard et mustélidés, sont essentiellement nocturnes et la chasse est interdite la nuit."
Défavorable," Il n’y a pas de nuisibles…., le 22 juin 2023 à 20h25","Il n’y a pas de nuisibles….. Ces animaux sauvages jouent un rôle dans le fonctionnement des écosystèmes naturels, notamment sur le plan sanitaire : le Geai des chênes, le Corbeau freux, la Corneille noire, le Renard roux et la Martre des pins peuvent par exemple consommer d’autres animaux malades ou morts, limitant ainsi la propagation de maladies et contribuant à maintenir un milieu en bonne santé."
Défavorable," L’homme n’est pas seul  sur Terre, le 22 juin 2023 à 20h28","L’homme n’est pas seul sur Terre. Comment se faitil que l’homme qui se prétend être plus intelligent que les autres espèces sur Terre, soit incapable de vivre en paix avec elles, sauf lorsqu’il peut les domestiquer?,Il serait temps qu’il prenne conscience que tous les animaux ont le droit de vivre, qu’ils méritent d’être respectés et qu’ils ont tous un rôle à jouer dans l’équilibre écologique.,Le progrès ce n’est pas de développer des technologies mais d’apprendre à vivre avec toutes ces espèces en cherchant le moyen d’y arriver, en étant plus intelligent."
Favorable," avis favorable, le 22 juin 2023 à 19h20","avis favorable. Ces espèces, notamment renard et mustélidés, sont essentiellement nocturnes et la chasse est interdite la nuit"
Favorable," très defavorable, le 22 juin 2023 à 19h26","très défavorable. si vous vouliez sauver la biodiversité il faudrait ne pas oublier le pire de tous les prédateurs qui passe la majorité de son temps à semer la destruction dans la nature : l’homme,pour les animaux foutez leur la paix la régulation se fera toute seule"
Défavorable," Espèces nuisibles , le 22 juin 2023 à 19h26","Espèces nuisibles . C’est une véritable honte ! Cette liste est choquante. ,Je vis au quotidien depuis presque NOMBRE ans aux côtés de ces animaux et je n’ai jamais eu ni vu des soit-disant dégâts… laisseznous vivre en harmonie avec les animaux."
Défavorable," Cessons d’exterminer les mustélidés dans le Pas-de-Calais, le 22 juin 2023 à 19h26","Cessons d’exterminer les mustélidés dans le Pas-de-Calais. Les habitants du Pas-de-Calais ne parviennent plus à apercevoir le moindre mustélidé. Le nouveau plan triennal du classement des espèces en ESOD prévoit l’extermination par tous moyens et en toutes périodes des belettes et des fouines. Il s’agit d’une atteinte gravissime à la biodiversité et pour tout dire d’un écocide pour les espèces concernées dans un des départements français parmi les plus dépourvus d’habitats pour la faune sauvage, à savoir les forêts et les bocages. Nos enfants ont le droit de bénéficier d’une biodiversité la moins restreinte possible et de pouvoir s’émerveiller de l’observation de ces animaux. A l’heure de l’effondrement global de la diversité du vivant, il est du devoir de notre génération d’inverser cette tendance."
Favorable," Oui au classement par départements non aux restrictions de mode de destruction., le 22 juin 2023 à 19h26","Oui au classement par départements non aux restrictions de mode de destruction.. Je suis tout a fait favorable aux classements proposés par départements qui sont issues de concertations et analyses de données pluriannuelles.,Toutefois pourquoi introduire brutalement une restriction de modes de destructions dans certains départements et pour certaines espèces.,Si une espèce est classée ESOD elle doit pouvoir être régulé par tous les modes de destruction légaux."
Défavorable," Défavorable , le 22 juin 2023 à 19h25","Défavorable . Les renards fouines blaireaux détruisent les rongeurs NOMBRE par an pour un renard,Les corvidés sont de super éboueurs et limitent les transmissions de maladie. Les nuisances sont faibles par rapport aux bénéfices."
Favorable," avis favorable, le 22 juin 2023 à 19h25","avis favorable. Il es indispensable de réguler les ESOD listés à partir d’observations, de constations de dégâts avérés aussi bien dans la nature que chez les particuliers. Les opposants ne savent que contester les chiffres fournis et devraient se demander pourquoi des champs sont vides de culture après plusieurs tentatives d’ensemencements entièrement détruits par les corvidés.,Les dégâts commis ne devraient pas être couverts par les chasseurs ou piégeurs qui interviennent bénévolement mais par les associations d’opposants."
Défavorable," Anne Marie Morel Chaussende, le 22 juin 2023 à 19h24",Anne Marie Morel Chaussende. Je suis CONTRE le classement du renard et du blaireau comme espèce nuisible.
Défavorable," Avis très défavorable , le 22 juin 2023 à 19h24","Avis très défavorable . Depuis que le renard avait disparu de notre territoire, les rats avaient envahi les jardins… depuis peu le sublime renard roux sort de son terrier et enfin la chaîne alimentaire reprend ses droits. ,Respectez le vivant et cessez de croire que l’homme est supérieur aux autres espèces. ,Merci de respecter la nature"
Favorable," Avis favorable , le 22 juin 2023 à 19h23","Avis favorable . Il faut absolument réguler ces espèces sans les éradiquer bien sûr, en rajoutant la pie destructrice de nids et le blaireau discret mais efficace en terme de dégâts."
Favorable," je suis favorable au projet d’arrêté ministériel, le 22 juin 2023 à 19h22","je suis favorable au projet d’arrêté ministériel. favorable au classement communal pour le département du NOMBRE , relatif aux Renard roux, Fouine, Corneille noire et Pie bavarde,,pour la totalité des propositions de classement ainsi que l’ajout de NOMBRE classements supplémentaires demandés par certains préfets,,contre l’article NOMBRE ajoutant des conditions limitatives de destruction."
Défavorable," Défavorable , le 22 juin 2023 à 19h22",Défavorable . Toute discrimination raciale pour l’humanité est passible d’amende et bien plus encore. Pourquoi l’humain s’octroie t’il donc le droit d’en faire chez les animaux ….
Défavorable," totalement opposé  à la destruction des animaux sauvages, le 22 juin 2023 à 19h22",totalement opposé à la destruction des animaux sauvages. Classification scandaleuse à l’encontre de tous les avis scientifiques . les renards sont indispensables pour lutter par exemple contre la pullulation des campagnols qui détruisent les cultures. Laissez les espèces se réguler elles mêmes.
Défavorable," avis défavorable à la liste ESOD 2023-2026, le 22 juin 2023 à 19h21","avis défavorable à la liste ESOD NOMBRE - NOMBRE . Avis défavorable à la destructions de nos animaux sauvages…, le NOMBRE juin NOMBRE à ,,Le « droit à détruire » des espèces est un non-sens écologique..Il faudrait faire une ,évaluation scientifique pour démontrer les soi-disant destructions faites par ces espèces et aucune n’a été faite.,,Ces animaux sauvages jouent un rôle essentiel dans le fonctionnement des écosystèmes naturels, notamment sur le plan sanitaire : le Geai des chênes, le Corbeau freux, la Corneille noire, le Renard roux et la Martre des pins peuvent par exemple consommer d’autres animaux malades ou morts, limitant ainsi la propagation de maladies et contribuant à maintenir un milieu en bonne santé. En outre, la prédation des rongeurs par les renards et les fouines permet la diminution du risque de transmission de la maladie de Lyme sur l’homme par les tiques qu’ils véhiculent.,Plusieurs ""ESOD"" sont de véritables auxiliaires des activités agricoles et forestières. En tant que prédateurs spécialistes des petits rongeurs (campagnols, mulots…), le renard, la belette, la martre et la fouine permettent de contenir les populations de ces espèces dans les parcelles agricoles. Par exemple, une belette consomme en moyenne NOMBRE rongeurs dans l’année et le renard roux jusqu’à NOMBRE .,,Des solutions alternatives à la destruction existent et ne sont presque jamais mises en œuvre. Il est ainsi possible de concilier la présence de corvidés et les pratiques agricoles : enfouissement plus profond des semences, meilleure stratification du paysage rural (haies, structures boisées, perchoirs naturels et installations de perchoirs pour rapaces, effarouchement…). ,Des solutions efficaces existent aussi pour limiter la prédation sur les volailles d’élevage (grillage à mailles étroites suffisamment haut et profondément ancré dans le sol, répulsifs, surveillance…).,,Merci de prendre en compte mon témoignage, il ne va que dans le sens de la préservation de la biodiversité dans l’intérêt de l’humanité et en aucun dans le sens d’intérêts privés et ou financiers."
Défavorable," Defavorable aux mesures restrictives, le 22 juin 2023 à 19h21","Défavorable aux mesures restrictives. Des mesures restrictives sont appliquée à la régulation du renard ou de la fouine pour limiter les campagnols, Le vrai problème du campagnol n’est pas une question de prédateur, mais une question de paysage agricole et d’agronomie (arrachage des haies, monoculture de prairie, destruction des murets et autres éléments fixes du paysage). Le renard et la fouine ne sont pas en voie d’extinction, au contraire il ne sont jamais aussi bien portés. Je suis président d’une ACCA et habite en milieu rural, les dégâts qu’occasionnent ces espèces sont considérables j’en suis témoin assez régulièrement. Croyezvous que les gens vont accepter de se laisser détruire leurs volailles et jardins sans rien dire et rien faire ? N’oublions pas la pie n’est plus classée en esod en Ardèche et qui occasionne des dégâts. Croyezvous que les ruraux en on pas assez de toutes ces complexités et interdictions dictées par des énarques qui sont à des années lumière de la ruralité?"
Favorable," avis favorable au projet d arrètè ESOD, le 22 juin 2023 à 19h21",avis favorable au projet d arrête ESOD. ces animaux sont nocturnes et la chasse est interdite la nuit
Défavorable," Contre avis défavorable , le 22 juin 2023 à 21h15",Contre avis défavorable . Des multiples études ont conclu l’importance des différentes espèces dans leur milieu et des erreurs ont déjà été faites dans le passé ! Arrêtons de les reproduire ses erreurs et laissons les animaux tranquilles.
Défavorable," Avis défavorable , le 22 juin 2023 à 21h15","Avis défavorable . En période d’urgence climatique, il est important de sauver la biodiversité dans son ensemble. Le renard est un régulateur des petits rongeurs et permet de lutter contre la maladie de lyme !"
Défavorable," Non à la destruction d’espèces, non au classifications sans fondement.
, le 22 juin 2023 à 21h15",". La biodiversité s’équilibre d’elle même, depuis la nuit des temps. Les dégâts invoqués sont la conséquence de la réduction des habitats naturels par l’extension des espaces urbanisés. Le seul nuisible est donc l’homme, Incapable de vivre en collaboration avec les autres êtres vivants, qui eux se passent aisément de nous."
Défavorable," Contre l’arrêté, le 22 juin 2023 à 21h15","Contre l’arrêté. Sur le fond - le respect de la vie : l’élimination d’êtres vivants ne représentant pas une menace sérieuse est égocentrique. La peine de mort a été abolie. Les non-humains mériteraient également davantage de bienveillance. ,Sur l’argumentaire de dégâts : il est contestable, car construit à charge sans prise en compte des bénéfices apportés par les espèces. ,Sur la mise en œuvre : l’absence de volumes limitatifs de destruction ne permet pas de garantir un maintien des espèces en état de conservation favorable."
Défavorable," CONTRE, le 22 juin 2023 à 21h15","CONTRE. Totalement contre. Des espèces classées nuisibles par lez chasseurs, cultivateurs, pour le profit, plaisir pré-historique de tire… des espèces indispensables dans l’écosystème. Tout simplement scandaleux, ces animaux doivent rester dans notre environnement, leur disparition causerait un grave déséquilibre (moins de renards, plus de tiques…)."
Favorable," Favorable au maintien Esod, le 22 juin 2023 à 21h14",Favorable au maintien Esod. Il faut que tout le monde trouve sa place avec l’activité humaine. Une régulation est nécessaire.
Favorable," avis favorable en totalité., le 22 juin 2023 à 21h13","avis favorable en totalité.. La régulation des nuisibles a toujours existé, cela n’a pas empêché qu’ils se reproduisent chaque années et que cette populations reste a un niveau identique d’une année a l’autre. Restons raisonnable dans nos propos et dans nos réflexions."
Favorable," Avis favorable , le 22 juin 2023 à 21h13",Avis favorable . Avis favorable pour le maintien de la liste.
Favorable," Avis favorable, le 22 juin 2023 à 21h13",Avis favorable. Favorable à la classification Esod des espèces citées.
Défavorable," Défavorable à cet arrêté ministériel, le 22 juin 2023 à 21h12","Défavorable à cet arrêté ministériel. Ces animaux ne sont pas plus nuisibles que nous le sommes pour l’ensemble de la biodiversité. De plus, aucune preuve n’est apporté au public sur l’ampleur des dégâts que ces êtres vivants auraient causés."
Défavorable," Avis defavorable, le 22 juin 2023 à 21h12","Avis défavorable. Selon plusieurs études la destruction du renard roux n’a aucun effet, la population se régule elle même. Cela a également été observé au Luxembourg, suite au retrait de la liste des ESOD le nombre de renards porteurs de l’échinococcose est passé de NOMBRE à NOMBRE . Je ne comprends pas pourquoi les avis et les études des scientifiques comme Frédéric Jiguet pourtant membre du ONCFS ne sont pas prises en compte."
Défavorable," Contre , le 22 juin 2023 à 21h12","Contre . Je suis contre car chaque espèce à sa place dans la nature.,Ces animaux sont dit nuisibles car ils dérangent certains humains.,Ne pas oublier que les animaux sont des êtres sensibles et à ce titre ils méritent notre respect et notre protection.,Les humains finiront par détruire la biodiversité, déjà à l’heure actuelle de nombreuses espèces sont en déclin ou même carrément disparues.,Alors oui je suis contre à NOMBRE"
