opinion,sujet,checked_text
," Contre l’ensemble de ce texte, le 22 juin 2023 à 23h29","Contre l’ensemble de ce texte. Les seuls nuisibles ici sont les humains complètement responsables de la dérégulation de la nature. La nature a de formidables mécanismes d’équilibrage et il n’est pas nécessaire de s’adonner à la de la soi-disant régulation tels des apprentis sorciers. ,Il n’existe pas de modèle qui permette de montrer que des espèces sont nuisibles, soyons un peu sérieux. ,Les liens de cause à effet si on les analyse avec un minimum d’honnêteté scientifique montrent en effet que pourchasser des animaux tout comme à en ""préserver"" d’autres conduit à des déséquilibres qui in fine sont préjudiciables à l’espèce humaine. Un exemple est celui du développement de la maladie de Lyme liée avec la diminution de prédateurs comme le renard. De la même façon l’agrainage des sangliers est une absurdité conduisant à la multiplication de l’espèce. ,On observe également que la réintroduction du loup conduit à la régulation de ces mêmes populations de sangliers, n’en déplaise aux chasseurs drômois.,La notion de nuisible est complètement absurde, tout autant que celle d’utile dans l’optique de faire une partition des espèces. Cela nie les dimensions holistique et systémique de notre environnement. Comment vouloir faire croire qu’une espèce est utile et l’autre nuisible comme s’il n’y avait pas d’interdépendance complexe dans nos écosystèmes. Le fondement même de ce texte est une énorme absurdité.,Il y a ici soit de l’ignorance ou de la mauvaise foi. Dans un cas comme dans l’autre, c’est désespérant et on ne peut qu’espérer qu’un brin de raison conduise à refuser ce genre de texte. On ne peut que conseiller à nos ardents adeptes de la classification binaire d’aller consulter la définition du mot systémique pour commencer à enrichir leur conceptualisation du monde.,Quand un gouvernement appréhendera ce type de sujet avec un minimum de sérieux et de rationalité alors on pourra envisager de croire ce qu’il raconte sur d’autres sujets et ou qu’il sait rester insensible à la pression des lobbies. Ce pourrait être un premier pas pour retrouver la confiance perdue dans nos institutions politiques (on peut rêver…)."
," Contre l’ensemble de ce texte, le 22 juin 2023 à 23h28","Contre l’ensemble de ce texte. Les seuls nuisibles ici sont les humains complètement responsables de la dérégulation de la nature. La nature a de formidables mécanismes d’équilibrage et il n’est pas nécessaire de s’adonner à la de la soit-disant régulation tels des apprentis sorciers. ,Il n’existe pas de modèle qui permette de montrer que des espèces sont nuisibles, soyons un peu sérieux. ,Les liens de cause à effet si on les analyse avec un minimum d’honnêteté scientifique montrent en effet que pourchasser des animaux conduit à des déséquilibres qui in fine sont préjudiciables à l’espèce humaine. Un exemple est celui du développement de la maladie de Lyme liée avec la diminution de prédateurs comme le renard.,La notion de nuisible est complètement absurde, tout autant que celle d’utile dans l’optique de faire une partition des espèces. Cela nie les dimensions holistique et systémique de notre environnement. Comment vouloir faire croire qu’une espèce est utile et l’autre nuisible comme s’il n’y avait pas d’interdépendance complexe dans nos écosystèmes. Le fondement même de ce texte est une énorme absurdité.,Quand un gouvernement appréhendera ce type de sujet avec un minimum de sérieux, alors on pourra envisager de croire ce qu’il raconte sur d’autre sujet. Il y a ici soit de l’ignorance ou de la mauvaise foi. Dans un cas comme dans l’autre, c’est désespérant et on ne peut qu’espérer qu’un brin de raison conduise à refuser ce genre de texte. On ne peut que conseiller à nos ardents adeptes de la classification binaire d’aller consulter la définition du mot systémique pour commencer à enrichir leur conceptualisation du monde."
," ESOD , le 22 juin 2023 à 23h27","ESOD . Homme de terrain je côtoie les agriculteurs, maraîchers et éleveurs qui sont en permanence et de plus en plus confrontés à de graves dégâts dus aux espèces ESOD particulièrement cette année avec des attaques inédites. Nombreux ont re semé plusieurs fois pour la même perte, perdu nombreuses volailles sans possibilité d’indemnisation ,et sont démoralisés. Il faut avoir les moyens légaux d’aider ceux qui nous nourrissent…"
," Pour, le 22 juin 2023 à 23h27",Pour. Oui à la régulation des espèces qui occasionnent des dégâts
," Contre ce projet d’arrêté , le 22 juin 2023 à 23h59","Contre ce projet d’arrêté . Les espèces décrites sont chassées depuis des décennies. Voiton une diminution de leur nombre ? Non. Il y a-il encore des dégâts ? Oui, ça arrive. Alors plutôt que de s’entêter à reproduire une action qui ne donne pas de résultat, je propose, au contraire d’interdire la chasse de TOUTES ces espèces. L’ étourneau sansonnet pose problème en ville ? Plantons plus d’arbres afin que leur concentration soit moindre. Des chênes notamment, afin que les geais, leurs prédateurs (ce serait donc dommages de les chasser !) puissent les réguler. Il y a trop de dégâts occasionnés par les belettes et de martres ? Laissons vivre les renards, qui sont leurs prédateurs naturels, plutôt que ce chasser ces derniers avec des ""traditions"" barbares comme le déterrage. Les corbeaux mangent les semis des agriculteurs ? Accompagnons ces derniers à se munir d’outils d’effarouchement efficaces, et menons des programmes pour réintroduire leurs prédateurs naturels. En somme : il y a une multitude de solutions alternatives à ce projet qui contrairement à ce dernier - qui prouve année après année son inefficacité n’ont pas ou peu été testées. Je suis donc contre."
," ESOD, le 22 juin 2023 à 23h59",ESOD. Avis similaire à la fédération de chasse de la Vienne
,"  pour l’ensemble de ce texte, le 22 juin 2023 à 23h59",pour l’ensemble de ce texte. il faut un peu ouvrir l’yeux et sortir de votre monde des Bisounours ces espèces cause beaucoup de dégât dans les cultures notamment les corneilles dans les semis de maïs ou il faut ressemé et qui ces qui paye le contribuable car l’état finance si vous aimez donné de l’argent à l’état pas moi et surtout par les temps qui cour. Je préfère sacrifier quelque oiseaux et mieux mangé a la fin du mois
," Pour, le 22 juin 2023 à 23h59",Pour. Pour le droit des chèvres et des transcendances LGBTIQ
," Je suis contre, le 22 juin 2023 à 23h58","Je suis contre. Je ne peut pas cautionner l’abus de pouvoir de ce genre de décision. Il serait temps que des responsabilités soient prisent et que un réel travail soit fait. Au lieu de toujours choisir la faciliter de la force et de la destruction. On appel cela un rêve au vu de notre gouvernement, mais je maintiens mon refus."
," Contre la liste ESOD, le 22 juin 2023 à 23h57","Contre la liste ESOD. Je suis contre la liste d’espèces susceptibles d’occasionner des dégâts car, au-delà de l’aspect éthique que cette liste questionne, cette décision politique est un non-sens scientifique, écologique et économique.,,En effet, d’une part, les nombreuses années d’observation scientifique prouvent le rôle écologique vertueux de ces animaux : régulateurs de populations d’autres espèces, dissiminateurs de graines, équarrisseurs naturels… Ces animaux sont indispensables dans nos écosystèmes.,,Par exemple :,,Un Renard Roux à lui seul peut manger plusieurs milliers de rongeurs ravageurs de cultures chaque année,Le Geai des Chênes est l’un des plus importants reboiseurs de France,Ces animaux, entre autres charognards, permettent la limitation de propagation de maladies, notamment la maladie de Lyme.,,D’autre part, il n’existe pas de protocole pour suivre leurs populations avec précision.,,De plus, les données sur les « dommages » réellement occasionnés et remontés par les piégeurs agréés aux départements sont basées sur de simples déclarations et restent donc partielles, voire biaisées. Il n’existe en effet pas de protocole standardisé pour identifier l’auteur de ces « dommages », ni pour évaluer la fiabilité des informations transmises.,,Enfin, la destruction des ESOD est réalisée sans obligation de résultats, ni de leur efficacité. Ce qui signifie qu’il n’y a actuellement pas d’évaluation des coûts et bénéfices écologiques et économiques, ni prise en considération des aspects éthiques de ces mesures.,,Frédéric Jiguet, ornithologue mais aussi professeur en biologie de la conservation au centre d’écologie et de science de la conservation au Muséum National d’Histoire Naturelle à Paris a démontré que les coûts payés par la société de destruction des ESOD sont bien supérieurs aux coûts des dégâts.,,Par exemple, « au Jardin des Tuileries il y a eu une prestation de NOMBRE mois qui a coûté NOMBRE Euros ; un piégeur agréé a installé une cage et a dû piéger et tuer entre NOMBRE et NOMBRE corneilles sur la période ». Pies qui, de surcroît, reviennent par la suite.,,Non seulement la destruction de ces espèces n’est pas efficace, mais surtout, des alternatives existent et fonctionnent !,,En bref, dans le contexte d’urgence écologique et de l’effondrement de la biodiversité, il est urgent de changer notre rapport au vivant, car cette destruction de masse “porte préjudice aux écosystèmes, voire à l’agriculture”.,,La science le démontre : écoutons ce qu’elle nous dit.,,Je suis donc contre la mort de millions d’individus pour rien, aux frais du contribuable, et ce pour les NOMBRE prochaines années."
,"  pour l’ensemble de ce texte, le 22 juin 2023 à 23h28, le 22 juin 2023 à 23h55","pour l’ensemble de ce texte, le NOMBRE juin NOMBRE à . il faut un peu ouvrir l’yeux ces espèce cause beaucoup de dégât dans les cultures notamment les corneilles dans les semis de maïs ou il faut ressemé et qui ces qui paye le contribuable car l’état finance si vous aimez donné de l’argent à l’état pas moi et surtout par les temps qui cour. Je préfère sacrifier quelque oiseaux et mieux mangé a la fin du mois"
," Contre !, le 22 juin 2023 à 23h55","Contre !. Je suis contre la liste d’espèces susceptibles d’occasionner des dégâts car, au-delà de l’aspect éthique que cette liste questionne, cette décision politique est un non-sens scientifique, écologique et économique."
," ESOD : pour…. , le 22 juin 2023 à 23h54","ESOD : pour…. . Je suis favorable au projet de classement du renard, de la corneille et de la pie sur l’ensemble du département du Gers. Je suis favorable à la totalité des propositions de classement ministériel et demande l’ajout de NOMBRE classements supplémentaires qui avaient été demandés par les préfets dans les départements. Je suis donc favorable aux NOMBRE classements accordés et contre les NOMBRE classements refusés par le ministère. Je suis contre le nouvel article (article NOMBRE ), ajouté à la dernière minute, et qui fixe des conditions limitatives de destruction."
," ESOD : pour…. , le 22 juin 2023 à 23h54","ESOD : pour…. . Je suis favorable au projet de classement du renard, de la corneille et de la pie sur l’ensemble du département du Gers. Je suis favorable à la totalité des propositions de classement ministériel et demande l’ajout de NOMBRE classements supplémentaires qui avaient été demandés par les préfets dans les départements. Je suis donc favorable aux NOMBRE classements accordés et contre les NOMBRE classements refusés par le ministère. Je suis contre le nouvel article (article NOMBRE ), ajouté à la dernière minute, et qui fixe des conditions limitatives de destruction."
," ESOD : pour…. , le 22 juin 2023 à 23h53","ESOD : pour…. . Je suis favorable au projet de classement du renard, de la corneille et de la pie sur l’ensemble du département du Gers.,Je suis favorable à la totalité des propositions de classement ministériel et demande l’ajout de NOMBRE classements supplémentaires qui avaient été demandés par les préfets dans les départements. Je suis donc favorable aux NOMBRE classements accordés et contre les NOMBRE classements refusés par le ministère.,Je suis contre le nouvel article (article NOMBRE ), ajouté à la dernière minute, et qui fixe des conditions limitatives de destruction."
," Sans titre, le 22 juin 2023 à 23h51","Sans titre. Arrêtons de voir les faits et posons nous la question de la cohabitation entre espèces. Les animaux agissent par instinct et non par volonté de destruction ou de profit. Nous sommes des êtres dotés d’une intelligence, prouvons le maintenant ! Il y a des moyens bien plus intelligents et altruistes que de classer ces espèces pour qu’elles soient autorisés à être chassées et ou tuées."
," Stop à la destruction des espèces ! , le 22 juin 2023 à 23h51","Stop à la destruction des espèces ! . Non ! Arrêtons tuer des animaux sous prétexte qu’ils occasionnent des ""dégâts""… Mineurs par rapport à ceux de l’Homme. Mobilisons notre énergie sur de vrais sujets qui amèneront une réelle transition."
," Thomas Sophie , le 22 juin 2023 à 23h51","Thomas Sophie . Contre ce projet. Les renards mangent des milliers de rongeurs chaque année. Ils sont utiles. Les corbeaux sont des oiseaux très intelligents, laissons-les tranquilles ! Quant aux geais et pies, ditesmoi quels énormes dégâts fontils, pour qu’on les tue ?"
," Contre , le 22 juin 2023 à 23h44","Contre . D’autres moyens sont possibles plutôt que l’extermination d’espèces pour régler nos problèmes, nous ne nous donnons pas les moyens de réfléchir à des solutions permettant un compromis entre nos intérêts d’humains et ceux de la faune."
," CONTRE !, le 22 juin 2023 à 23h44","CONTRE !. Je suis contre le ""classement des ESOD"", toutes les espèces mentionnées dans cette liste ont un rôle majeur nécessaire et vital quant au bon fonctionnement de la biodiversité, elles sont indispensables.,Je suis pour une réel réflexion commune sur les différentes solutions alternatives qui peuvent exister au lieu de tuer sans discernement.,Je demande donc le retrait de tout ces animaux de la liste des ESOD."
," Contre la liste esod, le 22 juin 2023 à 23h48",Contre la liste esod. Je suis contre cette liste. Le rôle de l’homme est de protéger la nature et non de la détruire. La régulation se fait naturellement et la planète n’a pas besoin de notre intervention.
," Stop, le 22 juin 2023 à 23h48",Stop. Faites cesser tout ça ! On a tout et tous décimés. Droit aux animaux !
," Classement esod, le 22 juin 2023 à 23h02",Classement esod. Pour laisser enfin une chance à la biodiversité de pouvoir exister en France. S’il vous plaît mettez fin à ce carnage organisé. Merci.
," Contre, le 22 juin 2023 à 23h00","Contre. C’est une mesure d’un autre temps. Nous devons partager les espaces et les ressources avec toutes les espèces. C’est parce que l’humain s’arroge le droit de se servir de tout en abondance et en excès qu’il considère ces espèces comme nuisibles. Les chaînes alimentaires sont ainsi faites que chaque animal a un prédateur, et que les ressources disponibles régulent les effectifs. Arrêtons le massacre, retournons à notre juste place !"
," Pour la régulation des nuisibles, le 22 juin 2023 à 23h00","Pour la régulation des nuisibles. Nous sommes favorables à ce projet d’arrêté ministériel fixant la liste, les périodes et les modalités de destruction des espèces susceptibles d’occasionner des dégâts (ESOD) du groupe II, pour la période du NOMBRE juillet NOMBRE au NOMBRE juin NOMBRE"
," Renards , le 22 juin 2023 à 22h58",Renards . Je suis contre l’inscription des renards globalement très utiles sur cette liste
," Pour, le 22 juin 2023 à 23h50","Pour. Je suis pour le classement des esod .,La régulation de ces espèces est indispensable pour préserver la biodiversité."
," Le classement ESOD des renards et mustélidés est contre-productif, le 22 juin 2023 à 23h49","Le classement ESOD des renards et mustélidés est contre-productif. Dans une perspective d’effondrement écologique en cours qui rendra la productivité agricole plus hasardeuse, décimer les animaux sauvages consommateurs de rongeurs est une idée obsolète, court-termiste et inadaptée aux enjeux de notre époque."
," Espèces dites nuisibles, le 22 juin 2023 à 23h49","Espèces dites nuisibles. Comment peuton en NOMBRE avec ce que l’on sait, continuer à vouloir supprimer des animaux que d’aucune jugent "" nuisibles "" Nous avons besoin de tous. Les geais des chênes se protègent dans mon jardin. Les pies, les grains, pics, merles et étourneaux, les corneilles s’invitent dans mon petit jardin. Tout est fait pour eux.,NOUS , nous occupons leur territoire ! Et non l’inverse !,Le genre de décision que vous prendrez influenceront nos votes c’est certain. Les lobbies ça suffit.,,Courtoisement."
," Contre cette liste esod , le 22 juin 2023 à 23h49","Contre cette liste esod . Au milieu de cette crise environnementale actuelle et à l’éveil progressif des consciences collectives, il parait tout à fait aberrant de volontairement poursuivre la perturbation de l’équilibre naturel pourtant responsable de nombreux services écosystémiques favorables aux activités humaines. Les espèces dites ESOD n’ont aucune validité scientifique si ce n’est leurs prétendus désagréments vis à vis des activités humaines pour lesquelles elles sont, bien au contraire, parfois de véritables auxiliaires face aux ravageurs de cultures favorisés par le dérèglement climatique."
," Esod auxiliaires de la biodiversité , le 22 juin 2023 à 16h57","Esod auxiliaires de la biodiversité . La régulation se fera d’elle même par concurrence ou raréfaction des proies.,Merci au geai pour disperser les glands au renard pour réguler les campagnols au blaireau pour lui fournir son gîte.,Il existe suffisamment de gibier."
," régulation
, le 22 juin 2023 à 16h13",". « Les moyens utilisés sont tout simplement ceux qui marchent, qui solutionnent les,problèmes. Ils sont aussi extrêmement réglementés. »"
," Une vie meilleure pour mes chats et mes poules, le 22 juin 2023 à 16h12",Une vie meilleure pour mes chats et mes poules. Tout à fait d’accord pour la régulation des espèces esod
," Contre l’arrêté, le 22 juin 2023 à 16h11","Contre l’arrêté. Qui peut croire une seconde que les renards ou les fouines font des dégâts dans les poulaillers quand on sait les conditions actuelles d’élevage intensif des volailles ? ,Si un particulier veut se faire son petit poulailler dans son jardin, alors qu’il le protège convenablement au lieu de condamner à mort tous les prédateurs potentiels. ,Même les chasseurs admettent que le problème c’est qu’ils s’attaquent aux galinettes cendrées qu’ils relâchent par millions pour ne pas rentrer bredouille le dimanche. Donc on tue des animaux sauvages indigène pour protéger du gibier d’élevage destiné à être abattu au fusil. Le monde marche sur la tête."
," Avis défavorable, le 22 juin 2023 à 16h11","Avis défavorable. C’est très compliqué : les espèces sont jugées nuisibles et il faut un tas de paperasse pour qu’un chasseur puisse lutter contre ces nuisibles !!! Deux poids deux mesures pour les nuisibles : on aurait le droit de tirer certaines espèces mais pas de détruire les nids (nous avons toujours intérêt à traiter le problème à sa source ?) !,Je ne me retrouve pas dans ces dispositions. La chasse se complexifie et je me demande où nous allons… bientôt il va falloir tirer les corbeaux freux mâles et seulement entre le NOMBRE et le NOMBRE de chaque mois et seulement s’il ne pleut pas avec une autorisation individuelle signée par une horde de fonctionnaires (humour mais cela montre que nos législateurs sont quelque peu éloigné du terrain) ."
," Contre le classement ""ESOD"", le 22 juin 2023 à 16h10","Contre le classement ""ESOD"". Je suis totalement défavorable à ce classement des espèces dites ""nuisibles"".,Sur terre, tout a sa raison d’être. Chaque espèce joue son rôle de régulation naturelle. ,Ce n’est que l’intervention excessive de l’homme sur la Nature qui a conduit à rompre cette homéostasie originelle.,Vous évoquez toutes les ""nuisances"" que ces espèces engendreraient, sans que celles-ci puissent être avérées ou formellement imputées aux animaux que vous voulez voir condamnés. ,Aucune étude, en effet, ne permet de prouver la réalité de ces ""nuisances"" et, pire encore, aucune preuve de l’efficacité de la destruction de ces ""ESOD"" sur la diminution des nuisances constatées ne peut être fournie.,Bref, on tue des animaux parce qu’ils seraient soi-disant ""susceptibles"" d’occasionner des dégâts sans être sûrs que ce soient vraiment eux qui sont à l’origine de ces ""dégâts"" (on devrait plutôt parler de petits désagréments pour les chasseurs qui n’aiment pas que leur gibier soient tués par une autre espèce), et surtout sans pouvoir démontrer que leur massacre contribue réellement à diminuer ces dégâts. ,Un autre point important qui devrait être pris en compte : c’est le rôle de régulation naturelle et de protection de l’agriculture que ces soi-disant ""nuisibles"" jouent dans la Nature.,Lors d’un procès, on est censé instruire autant à charge qu’à décharge. ,Il semblerait ici que le ""procès"" de ces pauvres bêtes soient malheureusement joué d’avance et que les cartes les plus avantageuses aient été distribuées à des personnes plus préoccupées de leurs petits intérêts personnels que de préservation de la biodiversité."
," La biodiversité massacrée pour le plaisir de quelques-uns, le 22 juin 2023 à 16h20","La biodiversité massacrée pour le plaisir de quelques-uns. Je suis contre cet arrêté qui conserve l’autorisation de tuer des animaux pour protéger le gibier des chasseurs. Cet arrêté prévoit en effet que renard, pie bavarde, martre, fouine et belette peuvent être tués à proximité des enclos destinés aux lâchers de gibier et dans les territoires où les chasseurs mènent des actions pour favoriser leur gibier préféré. Autant de zones dans lesquelles nos prédateurs naturels sont inévitablement attirés par une nourriture abondante et facilement accessible car peu habituée à la vie sauvage. Un simple loisir, qui plus est aussi funeste que la chasse, ne devrait pas primer sur la préservation de notre patrimoine naturel. On demande des efforts à tous pour le bien commun, pourquoi les chasseurs en seraientils exemptés ?"
," ESOD, le 22 juin 2023 à 16h19",ESOD. Avis défavorable au NOMBRE classements refuses par le ministre.
," Avis sur le projet D’arrêté (ESOD), le 22 juin 2023 à 16h18",Avis sur le projet D’arrêté (ESOD). je suis favorable pour ce projet.
," Mme , le 22 juin 2023 à 16h17",Mme . Complément pour cet arrêté. Il faut réguler avant d’être envahi et avoir encore plus de dégâts
," Je suis pour., le 22 juin 2023 à 16h17","Je suis pour.. L’État lui-même a recours à la régulation destruction de certaines espèces protégées (Loup,,Cormoran…), de même pour la ""sécurité"" sur les autoroutes…Et oui messieurs dames( bobos des villes !!!), pour votre sécurité l’état chasse le gibier présent dans l’enceinte des autoroutes. Pour votre sécurité… Vous avez déjà rencontré ""Bambi"" le long de l’autoroute ? Il est jolie, tous mignon…Mais imaginez vous l’avoir face à votre véhicule lancé à 130km h….. Même les associations de protection de la nature font de la régulation d’espèces (gibier ou même espèce protégées) . Je suis pour la protection du gibier, pour la régulation des espèces nuisible qui doit se faire surtout en période de reproduction du,gibier au printemps et la chasse est fermée à cette époque."
