opinion,sujet,checked_text
Défavorable," Non !, le 17 juin 2023 à 22h34",Non !. Contre l’arrêté !!! Stop au massacre !
Défavorable," Non au massacre du vivant, le 17 juin 2023 à 16h41","Non au massacre du vivant. Je suis contre ce projet d’arrêté. Laissons la nature, le vivant, le beau tranquille. Écoutons les scientifiques qui nous alarment sur l’effondrement de la biodiversité dans nos régions, ce sont des faits, des chiffres établis. Je veux que mes enfants et petits enfants puissent voir des renards, des blaireaux, des martres et des pies lors de nos balades. Ces animaux que certains qualifient de nuisibles (pardon, d’ESOD…) sont évidement utiles, voire indispensables pour l’environnement et pour nous, comme tout le vivant que nous méprisons globalement."
Défavorable," C’est inhumain. , le 17 juin 2023 à 16h42","C’est inhumain. . Je n’arrive pas à comprendre comment on peut faire souffrir ces animaux dits soi-disant de nuisibles.,Cette horreur doit s’arrêter maintenant. ,Il n’y a rien de plus beau que tous ces animaux et chacun d’entre eux est utile à la nature. ,Alors il faut les protéger et donc de ce fait, je m’oppose à l’extermination de tous ces animaux. D’autres possibilités alternatives existent pour les cultures agricoles."
Défavorable," Faire disparaître la notion de nuisibles (""dissimulée"" sous sa reformulation ESOD), le 17 juin 2023 à 16h43","Faire disparaître la notion de nuisibles (""dissimulée"" sous sa reformulation ESOD). Les arguments contre la destruction des prétendus ESOD sont nombreux. Les commentaires contre cette odieuse destruction sont suffisamment éloquents pour ne pas mentionner ces arguments de nouveau. Je me contenterai donc de plaider pour l’ABANDON PUR ET SIMPLE DE LA NOTION MÊME DE NUISIBLES ESOD. La seule espèce nuisible sur notre planète est humaine. Toutes les espèces sauvages sont utiles à la nature et nous les déclarons nuisibles uniquement quand elles interagissent d’une manière supposée négative (avec beaucoup de mauvaise foi ou sur la base d’informations incomplètes ou erronées) avec nos pratiques humaines qui, elles, sont destructrices multi-avérées de l’environnement (chasse, pêche, agriculture intensive chimique, artificialisation des sols, etc…).,Cordialement"
Défavorable," actions non pertinentes scientifiquelent et perturbant grandement la faune et les ecosystèmes., le 17 juin 2023 à 16h43","actions non pertinentes scientifiquement et perturbant grandement la faune et les écosystèmes.. Le renard, par exemple, est un prédateur efficace et contribue au contrôle des populations de petits mammifères, y compris des rongeurs nuisibles. Le geai des chênes et la pie bavarde sont des oiseaux intelligents qui jouent un rôle dans la dispersion des graines et l’équilibre de l’écosystème. Quant à la belette et la martre, elles sont également des prédateurs naturels qui peuvent aider à réguler les populations de divers petits animaux. Ces espèces vont deja souffrir du réchauffement climatique, de la sécheresse, des modifications de biotope, ce n’est pas la peine d’en rajouter. Merci de plutôt soutenir des solutions moins radicales et innovantes."
Défavorable," Contre ! Dites non à la chasse., le 17 juin 2023 à 16h36","Contre ! Dites non à la chasse.. Ce projet est à nouveau une atteinte à la biodiversité. Chaque animal a sa place. Dans les régions où la chasse est proscrite les animaux se régulent eux-mêmes par manque de disponibilité des ressources alimentaires.,Ce projet est conçu pour les chasseurs qui ont peur pour leurs proies, perdrix, lièvres etc."
Favorable," Favorable , le 17 juin 2023 à 16h36","Favorable . La liste des nuisibles doit être conservé, si nos anciens l’ont appliqué ce n’est pas pour rien"
Défavorable," Consultation du 15/06/2023 au 06/07/2023 - 6885 contributions, le 17 juin 2023 à 16h41","Consultation du NOMBRE NOMBRE NOMBRE au NOMBRE NOMBRE NOMBRE - NOMBRE contributions. Non à la destruction des Espèces Susceptibles d’Occasionner des Dégâts (ESOD) dites « du groupe NOMBRE ».,,Eve Émeri"
Défavorable," Animaux emblématiques de nos communes et pratiques d’un autre temps, le 17 juin 2023 à 16h36","Animaux emblématiques de nos communes et pratiques d’un autre temps. Bonjour,,Je m’oppose à ce projet.,Car il stigmatise des animaux qui font l’identité de nos territoires et font partie de notre patrimoine. (""le corbeau et le renard"" de J de la Fontaine par ex).,D’autre part, cette pratique de mettre sur une ""liste noire"" des animaux me semble d’un autre temps."
Défavorable," Avis sur arrêté ESOD, le 17 juin 2023 à 16h37","Avis sur arrêté ESOD. Madames, Messieurs,,,Par cette participation je marque mon désaccord à cet arrêté. Pour le peu de nature qu’il nous reste en France, il serait préférable de trouver une autre approche pour les dégâts occasionnels, sans piégeage ni chasse,,Cordialement"
Défavorable," Consternation , le 17 juin 2023 à 16h38","Consternation . C’est absolument choquant que l’homme s’approprie d’une telle manière le droit de vie ou de mort pour les espèces vivantes. ,Je dis NON à cette liste noire qui classe certains animaux qui ne sont nuisibles que pour nous, pas pour le reste de la biodiversité.,Et puis quoi encore ???,Pourquoi vous ne faites pas de projet de loi portant sur l’habitat, sur la protection des forêts… Etc ???,Les personnes qui ont écrit cette chose sont inutiles à la société en proposant une liste pour massacrer des animaux. ,Vous perdez juste votre temps en faisant cette loi complètement hors sujet, surtout étant donné la situation aujourd’hui. ,Je vous dis au revoir, mais je ne vous salue pas. ,Signé : une ado qui se demande si quelqu’un dans le gouvernement français possède plus de trois neurones."
Défavorable," Totalement défavorable , le 17 juin 2023 à 16h38","Totalement défavorable . La surproduction intensive détruit les écosystèmes c’est un fait, les politiques agricoles depuis les années NOMBRE vont à l’encontre de ces écosystèmes pourtant essentiels à la survie de l’homme. Les politiques de copinages et de « dragues électorales » envers les chasseurs ont conduites ces derniers à se laisser aller à des pratiques contre nature de plus en plus aberrantes et délétères. Quand allonsnous arrêter cette guerre systémique contre la nature, dont, in fine, l’homme est victime autant que le rite de la nature."
Favorable," Favorable , le 17 juin 2023 à 16h38","Favorable . Pour la protection du gibier, la régulation doit se faire surtout en période de reproduction du gibier au printemps et la chasse est fermée à cette époque. »"
Favorable," Projet d’arrêté pris pour l’application de l’article R. 427-6 du code de l’environnement et fixant la liste, les périodes et les modalités de destruction des espèces susceptibles d’occasionner des dégâts, le 17 juin 2023 à 16h39","Projet d’arrêté pris pour l’application de l’article R. NOMBRE - NOMBRE du code de l’environnement et fixant la liste, les périodes et les modalités de destruction des espèces susceptibles d’occasionner des dégâts. Je soutien la demande de la FDC et Je demande le maintien de la totalité de la liste compris putois et toutes les buses , des périodes et des modalités de destruction,,actuellement en vigueur de toutes les espèces susceptibles d’occasionner des dégâts.,,"
Défavorable," Opposé à la liste ESOD, j’en demande son retrait aux motifs évoqués dans mon commentaire si dessous., le 17 juin 2023 à 16h39","Opposé à la liste ESOD, j’en demande son retrait aux motifs évoqués dans mon commentaire si dessous.. J’émets un avis défavorable à l’existence d’une liste ESOD définissant certaines espèces comme étant des êtres nuisibles et donc autorisant juridiquement les hommes à les éliminer ou à en limiter leur nombre.,Cette liste n’a pas pour objectif de garantir la santé, la protection de la flore et de la faune, de prévenir les dommages sur les activités agricoles, forestières et aquacoles ; son but est de céder au lobby de la chasse, ces individus qui n’ont rien compris au fonctionnement de la nature mais qui utilisent de façon jouissive leurs beaux joujoux destructeurs (tuer un animal avec un fusil équipé d’une lunette de visée ne demande pas beaucoup de courage et d’intelligence…) et à celui des agriculteurs (du moins, une grande majorité d’entre eux) dont les membres par leur manque de connaissance en « écologie » (au sens scientifique et non politique du terme) et leur appât du gain ont contribué à la destruction de NOMBRE des insectes, à la disparition directe ou indirecte de beaucoup d’espèces d’oiseaux, à la pollution des sols et des cours d’eau. Un bel exemple dans le département du Doubs avec la fabrication du comté… En matière de nuisance, les renards et autres animaux « nuisibles » sont des petits joueurs au regard des ces deux espèces d’individus (à noter qu’ils sont souvent les mêmes !).,Oui, je suis tout à fait opposé à l’existence de cette liste aux motifs suivants :,- Estce que les espèces citées dans la liste ESOD menacent la santé et de la sécurité publique ? NON ; si « oui » le ministère devra l’argumenter par des études scientifiques indépendantes et sérieuses…,- Assurer la protection de la flore et de la faune en éliminant des espèces ? C’est un acte paradoxal. L’homo-sapiens dit « civilisé » serait plus intelligent que la nature cependant que nous vivons dérèglement et réchauffement climatiques, destruction de la flore et de la faune ! Et alors que ce même homo-sapiens, auteur d’écocide avéré, est incapable d’apporter des solutions à ces fléaux !,- Prévenir des dommages importants aux activités agricoles, forestières et aquacoles ? Les agriculteurs sont assez grands et irresponsables pour détruire leur propre environnement. Ils n’ont pas besoin des espèces citées ! Pesticides, insecticides, herbicides, monocultures, disparition des haies, déboisement, anthropisation des espaces naturels, etc… Là aussi, ces pauvres espèces « nuisibles » ne doivent pas avoir un impact très important dans ce domaine. Je suis même persuadé que leur utilité pour le bon fonctionnement de la biodiversité est bien supérieure aux dégâts qu’elles peuvent occasionner !,- Quant à la prévention de dommages importants à d’autres formes de propriété ? Historiquement ces espèces apparues bien, bien avant « l’homme moderne » ne seraient pas chez elles ? Nous les avons dépossédées de leur territoire et comme elles cherchent à retrouver celui-ci, nous nous octroyons le droit de les éliminer ! Le moins que l’on puisse faire, serait d’accepter de partager cet environnement qui nous est de facto commun (ceci dit, nous ne leur avons pas demandé leur avis, nous nous sommes imposés)…,Signé : un amoureux de la nature, non opposé au progrès, mais sensible à l’environnement dans lequel il vit et soucieux du respect du vivant…"
Défavorable," Pour qui vous prenez vous ?, le 17 juin 2023 à 16h37","Pour qui vous prenez vous ?. Cette consultation est une absurdité, elle fait croire que nous avons le droit de détruire. Alors que les états du monde entier ont un discours de protection envers la biodiversité, l’état français propose de réguler des espèces ""nuisibles"", mais nuisibles pour qui ? A l’échelle de l’environnement, ce ne sont pas ces quelques oiseaux et petits mammifères qui mettent en péril la planète ou la société, soyons sérieux ! Et l’homme est suffisamment intelligent pour adapter ses pratiques à leur présence non ? Abandonnez ce projet !,N. Andrė"
Favorable," Agriculteur ras le bol des dégâts , le 17 juin 2023 à 16h41","Agriculteur ras le bol des dégâts . Des surfaces de maïs, tournesol, soja et pois détruites par les pigeons et corvidés. Malgré l’utilisation d’effaroucheurs et de canons sonores ces oiseaux viennent prélever chaque jour notre gagne pain. Imaginez NOMBRE a NOMBRE graines consommés par jour et par individu. Avec une densité de semis de NOMBRE graines ha si vous avez NOMBRE corbeaux, votre hectare est mangé en NOMBRE jours soit NOMBRE euros de perte. Je suis favorable à l’arrête par nécessité et non par lobbyisme. Les agriculteurs devraient pouvoir les réguler sans autorisation, sans formalités administratives pour défendre leur récolte et leur revenu."
Défavorable," espèces susceptibles d’occasionner des dégâts, le 17 juin 2023 à 16h40","espèces susceptibles d’occasionner des dégâts. Je suis contre ce projet. Beaucoup d’espèces sont considérées comme des nuisibles (renards, geai des chênes…) alors qu’ils sont tous utiles.,Estce qu’on régule l’être humain qui est le plus gros destructeur de tous les temps? l’l est en train de s’auto-détruire en sachant mais en ne faisant pas grand chose à part défendre quelques poches très pleines."
Défavorable," Non au classement et à la destruction d’espèces jugées nuisibles qui ne le sont pas autant que les humains !, le 17 juin 2023 à 16h40","Non au classement et à la destruction d’espèces jugées nuisibles qui ne le sont pas autant que les humains !. Dans ma région (Franche Comté) ou ailleurs en France, je m’oppose vigoureusement à l’application de ce texte qui n’a pas de fondement scientifique.,A l’heure de la NOMBRE extinction de masse des espèces, il est irresponsable d’encourager la destruction d’êtres vivants qui sont des espèces clé des écosystèmes (voir travaux sur la présence des Renard et la contamination des tiques par la Borrelia, un exemple parmi tant d’autres)."
Défavorable," Présumés coupable, le 17 juin 2023 à 16h39","Présumés coupable. Je ne comprends pas cet acharnement à détruire (ou limiter) ces espèces dites nuisibles.,Elles font partie de la vie sur nos territoires, comme les autres.,Et y jouent aussi un rôle, par exemple en régulant les populations de petits rongeurs qui causent des dégradations dans les cultures.,Il appartient à chacun, éleveur, agriculteur ou particulier, de protéger son territoire contre les prédateurs qui s’y introduisent. ,Mais cela ne veut pas dire par destruction, il y a d’autres moyens de protection.,Il faut en particulier interdire le déterrage pour les renards.,Et laisser vivre ce qui reste de vie sauvage autour de nous …"
Défavorable," Avis défavorable, le 17 juin 2023 à 16h40","Avis défavorable. Il manque des données fiables sur la réalité des dommages . ,L’ état réel des populations des Esod est mal connu.,Ces espèces jouent un rôle dans le fonctionnement des écosystèmes naturels .,Ils sont des auxiliaires des activités agricoles et forestières, les oiseaux participant à la régénération de la végétation en dispersant les graines.,Il existe des alternatives à la destruction des Esod, comme l’enfouissement plus profond des semences et une meilleure stratification du paysage rural."
Défavorable," Non à la destruction des animaux, le 17 juin 2023 à 22h39","Non à la destruction des animaux. Je m’oppose fortement à cette stupidité d’éliminer les animaux ""dits nuisibles""…,Alors que nous traversons un écocide, il est anormal de participer à un animalisme en plus,NON NON NON à ce classement ESOD qui est un drame pour la biodiversité très malmenée."
Défavorable," Non, le 17 juin 2023 à 22h42","Non. Cessons de détruire la biodiversité, nous devons changer de modèle économique, arrêter la monoculture et produire des espèces adaptées aux enjeux d’aujourd’hui et encore plus de demain."
Défavorable," Contre, le 17 juin 2023 à 22h44","Contre. Arrêtez de massacrer la nature et la biodiversité.,,Arrêtez de gaspiller nos ressources dans des combats très l’oins des enjeux de notre époque.,,Arrêtez de laisser croire que les lobbies et les intérêts économiques de certains viendront améliorer la situation de notre pays."
Défavorable," Nuisible ? , le 17 juin 2023 à 22h44","Nuisible ? . Comment en NOMBRE pouvons nous encore classer des animaux ""nuisibles"",En Franche-Comté, la population de renard à chuté de NOMBRE suite à une maladie ""gale"" et on vient encore le classer nuisible.,Et qui va tuer les renards ? Les chasseurs ! Sans aucune aucune gestion et suivi de la population.,Il est temps d’avancer pour la biodiversité et non le contraire.,Je suis ancien chasseur, oui ancien car dans la vie on se doit évoluer tout comme les lois.,Cordialement"
Défavorable," Longue vie aux rats taupiers !, le 17 juin 2023 à 22h46",Longue vie aux rats taupiers !. La destruction des renards et autres prédateurs naturels des rats taupiers est une des causes de leur prolifération. Il ne faut pas pleurnicher ensuite sur la destinations pâturages.
Défavorable," Stop, le 17 juin 2023 à 22h48","Stop. Bonjour, j’habite en Beauce, nos champs sont vides. Vidés des oiseaux, des renards et plus généralement de toute vie sauvage. Même les chasseurs s’en plaignent…… Il est temps d’arrêter de détruire notre environnement au nom des cultures, élevage et néo ruraux qui découvre la campagne."
Défavorable," arreter le massacre, le 17 juin 2023 à 22h48","arrêter le massacre. la france est la patrie des droits de l homme et l homme ne peut vivre sans la nature et l animal ,,face a sa politique autorisant cette tuerie de masse face a des animaux soit disant nuisibles ( selon les lobby de Chasse ) elle est à contre courant de la lutte pour la bio diversité et ce décret et ceux qui l ont mis rédigé resteront dans l histoire comme ceux qui ont permis une des plus grande erreur du NOMBRE siècle et se seront laisser manipuler par différents lobby….,les scientifiques démontrent régulièrement l’utilité de ces animaux de part leur participation à la chaîne alimentaire et l équilibre naturel deja bien mis à mal par l homme,…,triste aveuglement"
Défavorable," CONTRE, le 17 juin 2023 à 22h48",CONTRE. Je m’oppose à la destruction de la petite faune régulatrice de nos campagnes
Défavorable," Méthode de classement à revoir, le 17 juin 2023 à 22h49","Méthode de classement à revoir. Il n’est pas acceptable que les classements en espèces nuisibles se basent sur les données invérifiables et biaisées des chasseurs. Si ESOD il doit y avoir (pas sûr !), au moins que les décisions se basent sur des statistiques de dégâts, des inventaires faunistiques et des études d’impact effectués par des spécialistes du service public. ,Si le service public est démuni (budget…), qu’il s’appuie donc sur les évaluations de toutes les parties prenantes et pas seulement sur celles de la petite minorité des chasseurs."
Défavorable," Espèces menacées , le 17 juin 2023 à 15h54","Espèces menacées . Je suis très inquiète et farouchement opposée à cette liste d’espèces soit-disant nuisibles. Tous les animaux ont le droit de vivre et même si l’on constate de temps en temps des nuisances occasionnés par ces animaux, il existe d’autres moyens de réduire ces dégâts que de les tuer ! ,Il faut s’appuyer sur des données scientifiques fiables et récentes et mettre tout en œuvre pour que les humains tolèrent mieux le reste du monde vivant. En région Bourgogne où je vis, je constate comme ailleurs, la diminution importante des oiseaux et renards pourtant très utiles dans la chaîne alimentaire."
Défavorable," Non à cette liste, le 17 juin 2023 à 15h55","Non à cette liste. Chaque espèce sur Terre mérite le respect et joue un rôle important dans l’équilibre de son écosystème. L’homme veut s’imposer en grand dominant de la nature. Mais à l’heure de la 6ème extinction de masse, il n’est plus d’actualité de détruite, tuer, chasser. L’homme devrait protéger toutes espèces vivantes pour la seule raison, qu’il est lui même une espèce, et qu’aucune espèce ne survit sans son écosystème vivant.,Stoppons le massacre !,Nous n’étions pas informés, encore il y a quelques années. Mais aujourd’hui, qui peut affirmer qu’il n’est pas au courant de l’extinction massive en cours.,Cette liste est juste une aberration."
Défavorable," Non à ce projet destructeur de la nature !, le 17 juin 2023 à 15h55","Non à ce projet destructeur de la nature !. Je suis totalement opposée à ce projet basé sur des arguments mensongers : non ! ces animaux ne sont absolument pas nuisibles, mais au contraire indispensables pour préserver la biodiversité. Je vis dans une région viticole et ce sont les pesticides largement utilisés qui sont nuisibles pour la santé de tous les êtres vivants (humains compris !). Stop à la destruction programmée de la nature ! Stop aux mensonges servant les intérêts de certains au détriment de tous !"
Défavorable," Changer de regard sur les animaux et développer les méthodes alternatives à l’abattage, le 17 juin 2023 à 15h56","Changer de regard sur les animaux et développer les méthodes alternatives à l’abattage. Monsieur le ministre,,,Nous partageons la terre avec les animaux. Tant qu’ils ne menacent pas notre survie, au nom de quoi nous permettons nous de les tuer ou d’autoriser certaines personnes à le faire ? C’est particulièrement choquant quand la motivation est de ""protéger"" un gibier destiné au final à être tué pour satisfaire la plaisir que certains prennent à tirer sur des animaux.,,Beaucoup d’études montrent aussi que ces animaux considérés comme ""nuisibles"" - même si le terme a changé pour une formulation plus édulcorée, la signification reste le même - ont un rôle important pour préserver l’équilibre des écosystèmes.,,Il existe des alternatives à l’abattage de ces animaux, des expériences l’ont montré. Plutôt que de l’autoriser à nouveau pour une longue liste d’espèces, je vous prie de rendre obligatoire le développement des méthodes alternatives qui ont fait leur preuve.,,Comptant sur votre engagement à aller vers des pratiques à l’égard des animaux plus dignes de notre société qui se dit civilisée.,,Denis Prost"
Favorable," Un vieux  chasseur (écolo), le 17 juin 2023 à 15h57","Un vieux chasseur (écolo). Je suis pour ce projet de loi concernant la régulation , par l’homme , des animaux classés ESOD de deuxième catégorie. Ces espèces n’ont plus de prédateurs et leur surnombre dans certain cas devient inquiétant pour la survie d’autres espèces.,Je profite de cet occasion pour demander le classement ESOD des chats errants."
Défavorable," Non à la destruction, d’autres solutions sont possibles, le 17 juin 2023 à 15h57","Non à la destruction, d’autres solutions sont possibles. Des solutions alternatives à la destruction existent et ne sont presque jamais mises en œuvre. Il est ainsi possible de concilier la présence de corvidés et les pratiques agricoles : enfouissement plus profond des semences, meilleure stratification du paysage rural (haies, structures boisées, perchoirs naturels pour rapaces, effarouchement…). Des solutions efficaces existent aussi pour limiter la prédation sur les volailles d’élevage (grillage à mailles étroites suffisamment haut et profondément ancré dans le sol, répulsifs, surveillance…)."
Défavorable," Que dit la science ? , le 17 juin 2023 à 15h52","Que dit la science ? . Une consultation publique ne peut pas décider de la vie ou de la mort d’un être vivant de la même manière qu’on fait pas justice soi même.,Laissez répondre la science (les écologues, biologistes, etc…) à ces questions."
Défavorable," Non à l’arrêté permettant le piégage des animaux sauvages, le 17 juin 2023 à 15h57","Non à l’arrêté permettant le piégeage des animaux sauvages. Le projet d’arrêté, révélé ce NOMBRE juin, est soumis à consultation publique jusqu’au NOMBRE juillet NOMBRE . S’il est adopté tel quel, il permettra aux chasseurs et piégeurs de continuer à massacrer des millions d’animaux sauvages quasiment toute l’année et sans limite de nombre dans tous les départements où s’appliquera le texte…,NOMBRE des Français se disent pourtant opposés au classement des espèces “nuisibles”, selon le sondage IFOP commandé par nos associations le mois dernier, et NOMBRE n’approuvent pas la méthode utilisée pour établir ce classement… Alors que tous les efforts devraient se concentrer dans la lutte contre le dérèglement climatique et l’effondrement de la biodiversité – deux crises planétaires intimement liées et générées par les activités humaines – nos gouvernants préfèrent hélas céder une fois de plus aux seuls intérêts des puissants lobbies de la chasse et de l’agriculture intensive, en portant davantage atteinte à la vie sauvage !,,IL EST DONC URGENT DE DIRE NON à cette hérésie sans queue ni tête, qui ne prend aucunement en compte la place essentielle occupée par tous ces animaux dans les écosystèmes, tout en faisant l’impasse sur les mesures alternatives à la destruction, dont l’efficacité est pourtant largement démontrée !"
Défavorable," Contre une liste des nuisibles , le 17 juin 2023 à 15h58",Contre une liste des nuisibles . Pour la majorité de la population ceux sont les chasseurs les nuisibles Cette liste sans référence scientifique n’a aucune légitimité La régulation est un prétexte contredit par la réalité du terrain
Défavorable," Non a cet arrêté , le 17 juin 2023 à 15h59",Non a cet arrêté . La nature se régule toute seul. Seul les profits de l homme la défi.
