sujet;checked_text;opinion
Consultation publique canis lupus (loup), le 26 novembre 2023 à 20h14;"Consultation publique canis lupus (loup). Madame, Monsieur, J’ai l’honneur parle présent avis d’émettre un AVIS DÉFAVORABLE concernant votre Projet d’arrêté fixant les conditions et limites dans lesquelles des dérogations aux interdictions de destruction peuvent être accordées par les préfets concernant le loup (Canis lupus). En effet j’attire votre attention sur les points suivants : NOMBRE Les données que votre Ministère présente pour justifier votre projet d’arrêté sont lacunaires et ne sont justifiées par aucun document en annexe. Aussi, il est demandé aux contributeurs que nous sommes de faire une confiance aveugle à votre administration qui par le passé à de nombreuses fois agit CONTRE les intérêts de la Sauvegarde des Milieux naturels au nom d’Intérêt économiques mal définis. Le respect du dialogue environnemental voudrait que les chiffres présentés, tant sur les populations de loups que sur les attaques et leur contexte, soient justifiés par des documents permettant réellement au public de comprendre dans quel contexte ce projet d’arrêté a été rédigé. NOMBRE L’État reste dans une logique de régulation du loup, pour freiner l’expansion de la population. Or, le loup, espèce protégée, devrait faire l’objet d’une politique de conservation pour des raisons de diversité de patrimoine génétique entre autre, et non d’éradication. NOMBRE La politique consistant à multiplier les tirs pour réduire les dommages aux troupeaux, mise en place depuis plusieurs années, n’a pas prouvé son efficacité. Il n’est donc pas raisonnable de poursuivre et même d’intensifier cette politique de destruction en renforçant la possibilité de tirs létaux au fil des arrêtés. C’est même TOTALEMENT CONTRE PRODUCTIF !!! En effet, l’État s’entête à vouloir limiter le territoire des loups, et notamment à le cantonner dans l’arc Alpin. NOMBRE Par ailleurs, comme pour le lynx, seuls les actes de braconnage seront décomptés du plafond de loup à abattre. Nous demandons que les loups tués par accident (collisions…) soient également décomptés ce qui est un minimum surtout lorsqu’il s’agit de chef de meute. NOMBRE Aucune remise en question de la ""non protégeable"" des troupeaux dans ce projet d’arrêté. Or, ce terme, non défini, ne veut rien dire et ne renvoi à aucun mode opératoire en harmonie avec des pratique de gestion durable des écosystème !!! Quelles mesures de protection ont été testées et installées pour ces fameux troupeaux qualifiés de non protégeable ? Je vous rappelle qu’exclure les loups d’un territoire défini comme non protégeable est incompatible avec les obligations de la Directive Habitat Faune Flore. On retrouve cette notion de non protégeable tout au long de l’arrêté, aussi bien pour les tirs de défense simple que les tirs de défense renforcée. Nous nous opposons à cette qualification de « troupeau non protégeable » sans qu’un diagnostic de vulnérabilité préalable et son analyse technique et financière soit réalisé par des techniciens de l’OFB ou de la DDT. NOMBRE Dans les deux derniers articles du projet d’arrêté, il est proposé de déterminer des zones – et non plus des troupeaux – où la non protégeable est admise pour les fronts de colonisation, ce qui conduirait à tuer des loups sans conditions préalables (effarouchement, mise en place de moyens de protection, etc.). Cela revient à vouloir cloisonner les populations de loups sur des territoires déterminés, et empêcher son expansion. IMPORTANT : Il n’est précisé nulle part que les tirs doivent être interdits en période de reproduction ce qui est, à nouveau, en contradiction avec l’obligation de maintenir un état de conservation favorable. FONDAMENTAL : Si les mesures de protection ne suffisent pas à éviter les déprédations, les mesures d’effarouchement devraient être un préalable obligatoire avant de pouvoir procéder à des tirs létaux. Or, ils sont possibles, mais ne sont toujours pas rendus obligatoires. Sans obligation, ils ne seront pas mis en place. Par ailleurs, les mesures d’effarouchement devraient être interdites dans toutes les réserves naturelles et pas seulement nationales. Concernant les tirs de défense, il n’est pas admissible de qualifier une attaque de loup comme un « acte de prédation pour lequel la responsabilité du loup ne peut être écartée »… Le loup est une espèce protégée et on ne peut pas se contenter d’une suspicion de culpabilité pour autoriser des tirs. NOMBRE La mise en œuvre de tirs de défense pour une durée de cinq ans est totalement en contradiction avec l’objectif de conservation de l’espèce loup. Ces autorisations délivrées par les préfets devraient être limitées à un an maximum et suspendues dès qu’un animal a été abattu, d’autant que le projet d’arrêté prévoit de permettre jusqu’à NOMBRE tireurs par troupeau et non plus un seul (limité à l’éleveur). NOMBRE Le projet d’arrêté prévoit l’abaissement du seuil de déclenchement des tirs. Pour un troupeau, NOMBRE attaques sur NOMBRE mois permettent le déclenchement d’un tir de défense renforcée. Ce seuil bas est en contradiction avec la notion de « dommages importants », l’un des préalables aux tirs de loup, selon la Directive européenne Habitat-Faune-Flore, d’autant plus qu’il est valable pour l’ensemble du territoire de la commune ! NOMBRE Les tirs de prélèvement devraient être interdits dans les réserves naturelles autres que nationales. La notion de dommages exceptionnels n’est pas explicitée. Les opérations de prélèvement sont élargies à l’occasion de battues, chasses à l’approche et à l’affût du grand gibier, avec du matériel spécifique (lunettes à visée thermique, source lumineuse…) qui sont révélatrices de la volonté de l’État de « DÉTRUIRE » le loup. Il est temps de sortir d’un imaginaire ""moyenâgeux"" totalement inadapté aux enjeux de diversité qui seront les nôtres pour les siècles à venir !!!";Défavorable
Avis défavorable , le 26 novembre 2023 à 20h00;Avis défavorable . Avis défavorable. L espèce humaine devrait plus modeste et la biodiversité n’a pas attendu l humain pour se développer. Nous jouons beaucoup trop aux apprentis sorciers en décidant de vie ou de mort sur les autres espèces et nous avons assez empiété sur les espaces de vie de toutes espèces. A nous de nous adapter en accompagnant notamment les éleveurs. Toute vie est précieuse et fait la richesse de notre planète de notre biodiversité. Le meurtre sur animaux devrait choquer tout être humain tout comme dans les abattoirs, lors des chasses, corridas et autres perversions humaines.;Défavorable
Sans titre, le 26 novembre 2023 à 19h50;Sans titre. Je ne suis pas d’accord., le NOMBRE novembre NOMBRE à Les loups ont autant leur place sur cette planète que tout autre être vivant, laisser vivre les loups ! Il y a des moyens pour que l’on puisse vivre ensemble.;Défavorable
Sans titre, le 26 novembre 2023 à 19h48;Sans titre. Avis est défavorable en ce qui concerne ce plan. Le loup doit rester protégé pour la Biodiversité et parce que tuer n’a jamais été une bonne solution surtout que d’autres solutions existent. Prenons exemple sur d’autres pays tels que l’Italie par exemple;Défavorable
AVIS DÉFAVORABLE, le 26 novembre 2023 à 19h38;AVIS DÉFAVORABLE. Prenons exemple sur nos voisins italiens qui ont mis en place des moyens de protection, la cohabitation est possible, il suffit de le refouloirs tuer est tellement plus simple.;Défavorable
Les concitoyens se plaignent de la prolifération des sangliers et les chasseurs ne parviennent pas à les réguler, le 26 novembre 2023 à 22h17;Les concitoyens se plaignent de la prolifération des sangliers et les chasseurs ne parviennent pas à les réguler. AVIS DÉFAVORABLE : Bon nombre de concitoyens se plaignent de la prolifération de sangliers occasionnant des dégâts dans les jardins de particuliers non clos… Les chasseurs avouent ne pas parvenir à réguler la population de sangliers. Le SEUL prédateur naturel du sanglier est le loup Il est temps de laisser le seul prédateur naturel du sanglier faire son travail auprès des sangliers, travail qu’il semblait mieux faire que les chasseurs car cette prolifération de sangliers n était pas problématique quand le loup existait encore dans nos régions. Concernant les problématiques d animaux d élevage victimes du loup peut être devrions nous nous poser la question de comment cela se passait quand ils étaient encore présents ? La présence de chiens patou et autres chiens de protections de troupeau (encore fautil qu ils soient suffisamment nombreux) semble être efficace à défaut du berger.;Défavorable
AVIS DÉFAVORABLE : problématique de prolifération de sangliers que les chasseurs ne parviennent pas à maîtriser : il vaut mieux donc laisser le SEUL prédateur naturel faire le travail , le 26 novembre 2023 à 22h25;AVIS DÉFAVORABLE : problématique de prolifération de sangliers que les chasseurs ne parviennent pas à maîtriser : il vaut mieux donc laisser le SEUL prédateur naturel faire le travail . AVIS DÉFAVORABLE : Bon nombre de concitoyens se plaignent de la prolifération de sangliers occasionnant des dégâts dans les jardins de particuliers non clos… Les chasseurs avouent ne pas parvenir à réguler la population de sangliers. Le SEUL prédateur naturel du sanglier est le loup Il est temps de laisser le seul prédateur naturel du sanglier faire son travail auprès des sangliers, travail qu’il semblait mieux faire que les chasseurs car cette prolifération de sangliers n était pas problématique quand le loup existait encore dans nos régions. Concernant les problématiques d animaux d élevage victimes du loup peut être devrions nous nous poser la question de comment cela se passait quand ils étaient encore présents ? La présence de chiens patou et autres chiens de protections de troupeau (encore fautil qu ils soient suffisamment nombreux) semble être efficace à défaut du berger.;Défavorable
avis défavorable, le 26 novembre 2023 à 23h14;avis défavorable. Le loup est indispensable à la biodiversité, son rôle régule et harmonise la nature. Il semble plus judicieux de se pencher sur le nombre d’animaux domestiques d’élevage qui dérègle le climat.;Défavorable
Tirs de régulation de Canis Lupus, le 26 novembre 2023 à 23h15;Tirs de régulation de Canis Lupus. Je serai bref ! Laissons les loups se réguler eux-mêmes, ils n’ont pas besoin de nous. Que dire des prédateurs bipèdes?;Défavorable
Mme Servais, le 26 novembre 2023 à 13h34;Mme Servais. Je suis défavorable à ce projet qui vise à tuer encore plus de Loups Ce sont des animaux protégés et utiles Alors arrêtons de les massacres SVP !;Défavorable
AVIS DÉFAVORABLE 26 NOV 2023 , le 26 novembre 2023 à 13h24;AVIS DÉFAVORABLE NOMBRE NOV NOMBRE . Je confirme ici mon avis défavorable les loups doivent être protéger sans régulation les moyens ne manque pas même s il sont plus contraignant qu un simple tir meurtrier. Le temps des armes à feu doit cesser. Éveillez les consciences et ouvrez de nouvelles voies pour nous, nos enfants et l humanité. Merci.;Défavorable
Dr haustete , le 26 novembre 2023 à 13h05;Dr chaussette . Avis défavorable Le loup est indispensable à la biodiversité;Défavorable
Défavorable à des tueries de loups, le 26 novembre 2023 à 18h50;Défavorable à des tueries de loups. Pourquoi vouloir limiter le nombre de loups alors que le gibier est présent dans nos forêts. Limitez donc plutôt la chasse et ainsi le loup, qui bénéficiera d’un gibier plus important dans les forêts, n’aura pas besoin de s’attaquer aux animaux d’élevage (qu’il conviendrait aussi de mieux protéger avec des chiens de berger). Il sera moins dangereux pour les populations d’avoir des loups plutôt que des chasseurs dans les forêts (voir les chiffres d’accidents de chasse annuels) Et si on arrêtait de se voiler la face ?aucune étude ne prouve l’efficacité des tirs de loups. Obligeons d’abord les éleveurs à mettre en place les mesures de protection possibles.;Défavorable
Défavorable , le 26 novembre 2023 à 12h09;Défavorable . Le rôle des PNA est de protéger, pourquoi tuer alors qu il existe des solutions non létales ? Les loups maintiennent un équilibre dans les milieux naturels . Alors que l ONF organise le massacre des cervidés, on veut tuer leur seul prédateur ! Les éleveurs doivent protéger leur troupeau.le loup est une espèce protégée et vulnérable.;Défavorable
Non au prochain plan loup., le 26 novembre 2023 à 12h09;Non au prochain plan loup.. Avis défavorable concernant le plan loup. Comment pouvons nous encore en etre là? l’étude de la possibilité de déclassement de l’espèce, aujourd’hui strictement protégée, ce qui est inédit pour un PNA l’élevage porté sur un piédestal, sans aucun bémol, alors qu’on sait que les Alpes, par exemple, sont parfois soumises à un surpâturage intense a contrario, il n’est fait mention que des impacts négatifs de la présence du loup, rien sur son rôle bénéfique et ses bienfaits écosystémiques, notamment pour la forêt et même pour l’agriculture et la sylviculture grâce à la régulation des ongulés sauvages le principe de non protégeable de certains troupeaux reste maintenu empêchant de fait l’équipement en moyens de protection et favorisant les tirs de loups.;PNA
Avis défavorable , le 26 novembre 2023 à 11h54;"Avis défavorable . Une fois de plus le lobby de la chasse et de l’agriculture fait son bout de chemin dans les décisions qui impactent ou impacteront prochainement les citoyens. De nombreuses fois démontré scientifiquement, le loup et les grands carnivores ont une place vitale dans le paysage européen ! S’en débarrasser ou à minima favoriser son isolement géographique grâce à cette ""campagne de chasse"", ne fait que précipiter l’espèce dans une pauvreté génétique et une disparition progressive du paysage. Choisir une option plus respectueuse du vivant devrait être la priorité des politiques. D’autant plus aujourd’hui avec une biodiversité en chute libre, intéressons nous davantage à ce vivant, élaborons des plans d’après ce que nous connaissons sur la cohabitation prédateurs-élevages (l’exemple italien), ne choisissons pas les solutions les plus simples à défaut de vouloir y réfléchir et enfin abandonnons ce projet d’arrêté !";Défavorable
avis défavorable, le 26 novembre 2023 à 13h59;avis défavorable. les états membres de l’Europe ayant une approche plus ouverte à la présence du loup sur leurs territoires sont un exemple à suivre. Les quotas et surtout le braconnage vont a l’encontre de la protection associée à cette espèce.;Défavorable
Absurde , le 26 novembre 2023 à 11h08;Absurde . Des solutions absurdes, de nombreuses études montrent l’importance du loup pour la biodiversité et la régulation des cervidés (bien plus efficace que nos dangereux chasseur alcoolique). Des solutions pour la protection des troupeaux existent, chiens de gardes, clôture des pâturages, tir dissuasif pour faire fuir les loups. Mais non la stupidité humaine souhaite exterminer et tuer. Il faut coexister et non détruire la moindre chose qu’il ne nous plaît pas.;Défavorable
les loups sont protégés par l’Europe, le 26 novembre 2023 à 10h29;les loups sont protégés par l’Europe. Comment peuton aller à l’encontre des lois européenne ?;Défavorable
Contre les tirs de loups, le 26 novembre 2023 à 10h26;Contre les tirs de loups. Le loup est le prédateur naturel qui régule les espèces en surnombre nuisant à la biodiversité (cerfs, sangliers). Il chasse en meute, mais son habitat et ses territoires de chasse se réduisent sous la pression humaine. Lorsque les loups dominants sont abattus, il y a dispersion de la meute, des jeunes sans expérience sont livrés à eux même. Un loup solitaire ou des loups inexpérimentés vont alors se rabattre sur des proies bien évidement plus faciles à chasser. Les animaux domestiques peuvent faire partie de ces proies d’autant plus que des troupeaux de milliers de moutons s’offrent à lui quelques fois… Ils sont pourtant responsables de la mort de bien peu de ces animaux d’élevage. Tout le monde sait très bien qu’il faut aussi se tourner vers les chiens errants pour avoir souvent une raison à ces morts. Le loup contribue à préserver la structure des écosystèmes, il joue un rôle primordial et essentiel dans le maintien de la biodiversité. Voici pourquoi je suis farouchement pour la protection de cette espèce.;Défavorable
Sans titre, le 26 novembre 2023 à 10h24;Sans titre. Contre le projet d’abattage des loups arbitraire, systématique et exponentiel. Au mieux, ne pourrait être toléré que l’exceptionnel concernant un individu particulier s’obstinant à commettre des prélèvements domestiques alors que toutes les mesures de protection ont été prises. Et encore, le mieux serait de l’endormir et de le délocaliser.;Défavorable
Défavorable au projet d’arrêté , le 26 novembre 2023 à 10h07;Défavorable au projet d’arrêté . Il faut arrêter de tirer sur les loups ! on les accuse de tous les maux mais comment font ils en Italie où la cohabitation avec cette espèce ne pose pas de problèmes? Les loups jouent un rôle dans l’équilibre de la biodiversité en régulant naturellement certaines espèces comme les cervidés. Cette régulation ne plait pas aux chasseurs qui vient les loups comme des concurrents à LEUR gibier. Commençons aussi par ne pas empiéter sur le territoire historique des loups et un certain nombre d’attaques de troupeaux disparaitront et mettons en place de vraies protections de ces troupeaux en ne les laissant pas vagabonder seuls …;Défavorable
Stop, le 26 novembre 2023 à 10h01;Stop. Stop. Il est temps d’apprendre à vivre avec ce qui nous entoure Quelle est la prochaine étape ? Pleurer sur une espèce disparue de plus dans les vitrines des musées d’histoire naturelle ?;Défavorable
défavorable, le 26 novembre 2023 à 09h46;défavorable. vous vous tirez une balle dans le pied ! les loups sont nécessaires pour l’ équilibre de la biodiversité;Défavorable
Avis défavorable pour un animal emblématique de la France - le 27/11, le 26 novembre 2023 à 23h26;Avis défavorable pour un animal emblématique de la France - le NOMBRE NOMBRE . Le loup est indispensable à la biodiversité et son rôle est plus que jamais essentiel pour réguler les espèces. Le loup est un emblème et fait partie du patrimoine français et européen. On le retrouve dans notre histoire, nos contes, sur nos blasons, dans nos chansons, dans nos films et nos fables. Il faut absolument le protéger.;Défavorable
le loup est plus utile que l’élevage, le 26 novembre 2023 à 11h03;le loup est plus utile que l’élevage. En premier lieu, l’élevage est une plaie pour la planète. Il est à l’origine du réchauffement climatique et de la 6e extinction de masse. Vous comptez donc y participer. Ensuite une étude récente datant de décembre NOMBRE montre que les tirs de prélèvement sont en majorité inutiles. Pendant une courte période il n’y a plus d’attaques sur le secteur, mais cela revient, car de toute façon la nature a horreur du vide. Un loup qui part, c’est un autre loup qui revient. Lorsqu’un loup est tué, d’autant plus s’il s’agit d’un chef de meute, cette dernière peut potentiellement éclater. Des jeunes loups se retrouvent ainsi isolés et chassent de manière désorganisée, sur des territoires parfois distants. Dans les Alpes-de-Haute-Provence, en Italie… certains éleveurs ont fait le choix de cohabiter avec les loups. Il suffit qu’ils s’en donnent les moyens au lieu de passer par l’abattage irresponsable et inefficace. pour votre information https: _URL_ tchatche 3HWrkC3NIiA&t 179s;Défavorable
Avis très défavorable, le 26 novembre 2023 à 18h42;Avis très défavorable. Ces dérogations sont un non-sens et vont contre les lois européennes. Le loup peut et doit être protégé et les tirs limités au maximum. Les seuls tirs qui devraient être autorisés sont les tirs d’effarouchement. Non mortels, il ont un effet d’apprentissage et contribuent à la coexistence des loups et des activités d’élevage.;Défavorable
Avis défavorable à ce projet d’arrêté, le 27 novembre 2023 à 16h30;Avis défavorable à ce projet d’arrêté. Les conditions et mesures des tirs d’une espèce pourtant protégée soumise à dérogation (pour dérangement et destruction) sont largement facilitées via cet arrêté ! Il est inadmissible que des tirs nocturnes puissent ainsi être effectués sans éclairage préalable de la cible, que plusieurs tireurs (dont chasseurs) pouvant être mobilisés puissent utiliser des lunettes à visée thermique. Il s’agit clairement d’effectuer une forme de chasse aux loups, qui peut par ailleurs, également mettre en danger la sécurité et la tranquillité d’autrui (animaux et humains alentours). L’accent et les moyens techniques et financiers doivent être mis sur la protection des troupeaux, non par des moyens létaux, alors même que ceux-ci n’ont pas fait l’objet d’études et d’évaluation dans le précédant PNA.;Défavorable
Avis défavorable sur le Projet d’Arrêté Ministériel fixant les conditions et limites des tirs de loups, le 27 novembre 2023 à 14h13;Avis défavorable sur le Projet d’Arrêté Ministériel fixant les conditions et limites des tirs de loups. Je tiens à exprimer mon avis défavorable concernant le Projet d’Arrêté Ministériel fixant les conditions et limites des tirs de loups actuellement en consultation. Plusieurs points soulevés dans ce projet suscitent des préoccupations majeures quant à leur impact sur la conservation de la population de loups en France. Tout d’abord, le nombre de tirs prévu semble excessif et peu compatible avec l’objectif de conservation de l’espèce. Le fait que NOMBRE loups puissent être abattus en NOMBRE , représentant NOMBRE de la population de loups, est alarmant. À ce jour, NOMBRE loups ont déjà été tués, accentuant davantage l’état défavorable de la population de loups. La possibilité de tirs sur les fronts de recolonisation est particulièrement préoccupante, car cela pourrait entraver le processus naturel de rétablissement des populations dans des zones où elles ont été historiquement présentes. La permission de tirs même en l’absence de troupeaux et aux abords de troupeaux non protégés soulève des questions sur la nécessité réelle de ces mesures. Des tirs sans protection des troupeaux risquent d’agir en contradiction avec l’objectif de coexistence harmonieuse entre le loup et les activités d’élevage. Par ailleurs, l’absence de prise en compte des avis scientifiques dans le projet d’arrêté est inquiétante. Les recommandations des experts devraient constituer un fondement essentiel pour déterminer les conditions et limites des tirs de loups, garantissant ainsi une approche basée sur des données scientifiques solides. En conclusion, le Projet d’Arrêté Ministériel semble négliger les principes fondamentaux de conservation de l’espèce en autorisant des tirs excessifs, en particulier sur les fronts de recolonisation, et en ne tenant pas compte des avis scientifiques. Je vous encourage vivement à reconsidérer ces aspects et à réviser le projet en faveur d’une approche plus équilibrée, respectueuse de la biodiversité et propice à la cohabitation entre le loup et les activités d’élevage.;Défavorable
