sujet;checked_text;opinion
NON AUX DEROGATIONS, le 15 novembre 2023 à 21h35;NON AUX DÉROGATIONS. Au vu de l’avis défavorable du CNPN à propos du bilan du Plan National Loups NOMBRE - NOMBRE , qui a été rendu en juillet NOMBRE et qui relève l’absence de réel bilan avec indicateurs pour procéder à une véritable évaluation…et sachant que le loup est strictement protégé au niveau européen ( dans la convention de Berne relative à la vie sauvage et à la conservation des milieux naturels de l’Europe et dans la directive Habitats Faune Flore) il me semble évident de ne pas accorder de dérogations aux interdictions de destructions de loups Ce sujet n’a pas lieu d’être sauf si l’on veut anéantir le monde sauvage et sa biodiversité;Défavorable
La gestion du loup ne va pas dans la bonne direction avec cet arrêté, le 15 novembre 2023 à 10h07;"La gestion du loup ne va pas dans la bonne direction avec cet arrêté. Le loup est déjà la seule espèce en France qui peut être ""détruite"" via des dérogations d’espèces protégées toute l’année, quelle que soit son écologie, si les femelles sont gestantes ou allaitantes, je ne comprends pas qu’on veuille aller plus loin dans sa gestion au lieu de réellement protéger cette espèce qui peut, par des moyens adéquats, vivre en interaction avec les activités humaines comme l’élevage sans problème. Ce projet d’arrêté me semble donner trop de pouvoir aux préfets pour détruire le loup et trop de latitude pour accorder des SEP.";Défavorable
Contre ces nouvelles dérogations , le 15 novembre 2023 à 11h31;Contre ces nouvelles dérogations . Que les éleveurs travaillent avec des chiens et ne laissent pas les brebis seules. Bizarrement, à l’époque où il n’y avait pas d’aides de l’Europe il y avait moins de brebis dévorées… Bref, travaillons comme le faisaient nos ancêtres et nous n’aurons pas de problème avec le loup. A trop vouloir empiéter sur les terres des autres animaux, c’est l’humain qui finit par tout détruire. Ne peut on pas vivre tous ensemble en se respectant ? Et je vois arriver d’ici quelques mois années les alertes pour sauvegarder le loup qui finalement se retrouve en sous effectif. La vie n’est qu’un éternel recommencement, dommage que ce soit la faune et la flore qui en pâtissent tout ça pour favoriser encore une fois l’élevage intensif.;Défavorable
avis favorable, le 15 novembre 2023 à 14h39;avis favorable. avis favorable pour les dispositions de cet arrêté encadrant les autorisations de destruction qui se justifient au regard de l’impact de certains individus sur les activités humaines et les populations. L’espèce s’est fortement développée (en nombre et en territoires recolonisés) au niveau européen et son statut doit évoluer en cohérence.;Favorable
Avis défavorable à cet arrêté injustifié, le 15 novembre 2023 à 17h01;"Avis défavorable à cet arrêté injustifié. Le loup a un rôle écologique important et son retour dans les forêts françaises doit être perçu comme une chance pour la préservation de la biodiversité. Pourtant la France applique déjà une politique de régulation sévère vis-à-vis de cette espèce ( NOMBRE à NOMBRE de la population de loups pouvant être abattus chaque année) au mépris des avis scientifiques alarmants et défavorables. Par ailleurs, le gouvernement français alloue des budgets colossaux à la protection des troupeaux et à l’indemnisation des éleveurs en cas d’attaques sur leurs troupeaux, sans s’assurer d’une part que les troupeaux attaqués sont effectivement protégés par les moyens de prévention subventionnés, et d’autre part que les dommages déclarés sont réellement dus à des attaques de loups. Avant d’estimer que la présence du loup constitue une menace nécessitant un nouvel assouplissement des autorisations de tirs, la Fondation Brigitte Bardot appelle le gouvernement français à appliquer la réglementation européenne en vigueur (directive Habitats) pour préserver cette espèce menacée tout en protégeant les troupeaux avec des moyens efficaces et contrôlés. La Fondation Brigitte Bardot s’oppose à ce projet d’arrêté car il vise notamment : - A accorder des autorisations de tir de défense limitées dans le temps mais qui ne s’éteignent pas une fois le loup tué (donc des autorisations de tir non limitée quantitativement) ; - A accorder l’autorisation à NOMBRE tireurs (et non un seul comme actuellement, ce qui multiplie les possibilités de tirs) ; - A accorder des autorisations de tir à partir de NOMBRE bêtes tuées sur un an, ce qui va à l’encontre de la notion de dommage important, qui s’applique normalement pour déroger à la protection du loup ; - à reconnaître des zones non protégeable, ce qui permettrait de recourir au tir létal sans avoir à justifier des mesures de protection des troupeaux légalement requises. La Fondation Brigitte Bardot s’associe donc totalement aux conclusions du CNPN précisant qu’« Il n’y a en conséquence plus aucun dispositif de gradation réelle des tirs létaux, qui peuvent plus vite évoluer en tirs de défense auparavant qualifiée de « renforcée ». La suspension de l’autorisation dès lors qu’un loup a été tué ou blessé ne figure plus dans le texte proposé. Comme évoqué plus haut, il y a là un risque de multiplication des destructions sous couvert de la même autorisation initiale. Tous ces facteurs combinés ont pour conséquence d’augmenter la réalisation des tirs létaux et, par là même, présentent un risque pour la conservation de la population de loup. » La FBI rappelle également l’avis défavorable du CNPN à propos du bilan du Plan National Loups NOMBRE - NOMBRE , qui a été rendu en juillet NOMBRE et qui relève l’absence de réel bilan avec indicateurs pour procéder à une véritable évaluation… Cette politique de régulation du loup, favorisée par un assouplissement des conditions de recours au tirs létaux, ne se base sur aucun élément chiffré et aucun retour d’expérience et va à l’encontre de la réglementation européenne. D’autant plus que les contrôles de terrain concernant la mise en place des moyens de protection, condition pourtant essentielle à l’autorisation des tirs létaux, sont extrêmement faibles ( NOMBRE sur la période NOMBRE - NOMBRE dont NOMBRE , NOMBRE non conformes, NOMBRE en NOMBRE ) et que le système d’indemnisation français, basé sur l’auto-déclaration est très généreux. Pour l’ensemble de ces raisons, la Fondation Brigitte Bardot appelle le gouvernement à abandonner ce projet d’arrêté et à réaliser dès à présent dans une évaluation sérieuse et chiffrée du plan loup NOMBRE - NOMBRE afin de mettre en œuvre des mesures favorisant la coexistence entre troupeaux et loups en se fondant sur des données scientifiques et des expérimentations respectueuses de la protection des espèces.";Défavorable
loup, le 15 novembre 2023 à 18h05;loup. le loup doit vivre et se nourrir en groupe, si il attaque les troupeaux c est que le groupe a était réduit donc insuffisant pour chasser le gibier sauvage , voila ou on va encore accélérer les attaques de troupeaux;Défavorable
Avis favorable au projet d’arrêté, le 15 novembre 2023 à 18h35;Avis favorable au projet d’arrêté. La dynamique d’expansion du loup doit être contrôlé, ce n’est pas une espèce en péril ( voir les chiffres de population au niveau européen) loin de là. Je trouve le texte de l’administration comme un juste équilibre entre le maintien d’une population pérenne ( entre NOMBRE et NOMBRE loups ), la protection des troupeaux et des autres usagers de la nature.;Favorable
Avis défavorable à cet arrêté, le 15 novembre 2023 à 19h15;Avis défavorable à cet arrêté. Le loup a un rôle écologique important et son retour dans les forêts françaises est une chance pour la préservation de la biodiversité. La France applique déjà une politique sévère de régulation vis-à-vis du loup et d’autres animaux sauvages. Si dérogation il y a, les tirs doivent être confiés à des employés de l’État et non à des bandes d’amateurs prêts à exterminer tout animal sauvage considéré comme nuisible.;Défavorable
Avis défavorable argumenté, le 15 novembre 2023 à 19h30;"Avis défavorable argumenté. Au plan formel, je tiens à souligner que, comme il est écrit dans le préambule juridique des attendus, ""Le loup est une espèce strictement protégée au niveau international et européen"". Si je me réfère simplement au dictionnaire Larousse, l’adverbe ""strictement "" marque une ""une manière totale, absolue"". Tout ce qui suit relève donc d’un détournement de sens. Au plan pratique, le tir de loups suite à des attaques contribue à désorganiser les meutes et empêche toute transmission d’information au sein de ces meutes. Le loup a survécu en Europe car il a su apprendre de ses erreurs : aujourd’hui, prendre une décharge électrique, se faire mordre par un chien de troupeau peut conduire les loups à éviter les animaux domestiques. C’est ce type de moyens dissuasifs associés à des moyens de protection et de gardiennage qui doit prévaloir sur les destructions.";Défavorable
Dérogations aux interdiction de destruction des loups, le 15 novembre 2023 à 19h38;Dérogations aux interdiction de destruction des loups. La seule méthode efficace pour que les loups redeviennent une espèce sauvage c’est de les chasser avec des chiens spécialisés afin de leurs donner la peur des hommes et des chiens sinon on va tout droit à une catastrophe écologique qui commence déjà à exister dans certains départements. Il va falloir frapper vite et fort avant le déclin et la disparition de nombreuses autres espèces prédatées par le loup.;Indéterminé
avis negatif, le 15 novembre 2023 à 17h37;avis négatif. Avant de proposer ou à l’occasion de ce nouvel arrêté, il serait quand même nécessaire de tenir compte des avis et conclusions du CNPN qui indique que cet arrêté implique la perte du dispositif de gradation réelle des tirs létaux, qui pourront plus vite évoluer en tirs de défense, auparavant qualifiée de « renforcée ». La suspension de l’autorisation dès lors qu’un loup a été tué ou blessé entraîne un risque de multiplication des destructions sous couvert de la même autorisation initiale. Ce nouvel arrêté va faciliter la réalisation des tirs létaux et donc une fragilisation de l’espèce protégée. Rappelons à cet égard que le bilan du Plan National Loups NOMBRE - NOMBRE , démontre l’absence d’analyse permettant l’évaluation des mesures de destruction réalisées à ce jour. La modification du décret ne s’appui donc sur aucun élément chiffré nécessitant l’augmentation des tirs létaux pour diminuer les attaques et dégâts aux élevages.;Défavorable
Avis favorable, le 15 novembre 2023 à 20h42;Avis favorable. Bien trop insuffisant mais c’est déjà un progrès. Il faut que l’espèce ne soit plus protégée ou que sa protection soit limitée aux seuls parc nationaux. La France a vécu sans loups pendant de très nombreuses années sans le moindre inconvénient. Ses nuisances justifient son éradication sauf à démontrer son utilité. Aujourd’hui sa présence menace de disparition une espèce bien plus utile : le mouflon, mais aussi le pastoralisme.;Favorable
Défavorable, le 15 novembre 2023 à 21h02;"Défavorable. Le loup est une espèce protégée sauf dérogation. Certains agriculteurs ne ""jouent pas le jeu"" et ne tente même pas de protéger leur troupeaux. Pourquoi auraitil droit à des faveurs ? Par ailleurs, tuer un loup n’est pas une solution à long terme et augmente le nombre de dégâts comme l’atteste la littérature et les études sur le sujet. Cela est contre productif et coûte aux contribuables. Les dérogations et prélèvements ne doivent pas être systématiques dans le seul but d’apaiser les éleveurs de nos campagnes et exciter les adeptes de la gâchette. D’une part, parce qu’ils ne sont pas seuls sur le territoire, d’autres part car le loup est pour eux (les éleveurs) ""une goutte d’eau"" résultant d’un mal-être bien plus ancien et profond du monde agricole (voir les cas de suicides, non imputés au loup…). Certains dommages sont indemnisés alors qu’il s’agit de chiens errants. Aucune mesure n’est prise pour tuer ces chiens et exclure le loup. Cet argent public pourrait être alloué ailleurs ! L’augmentation du nombre de tireurs de nuit augmente aussi le risque d’accident et ne favorise pas la sécurité des intervenants. Par ailleurs, je suis contre l’intervention des lieutenants de louveterie chasseurs et pour une action NOMBRE MI de l’OFB. La suppression de l’éclairage peut augmenter le risque de tuer d’autres animaux ; la caméra thermique ne permettant pas toujours d’identifier à coup sûr l’espèce visée. Je suis contre la suppression de ""la suspension des tirs de défense renforcée après la destruction d’un loup"". Le CNPN a émit un avis défavorable. Le nouveau Plan National Loup n’est pas à la hauteur de mes attentes en tant que contribuable car il n’a pas tenu compte des éléments scientifiques apportés par les spécialistes. Il est grand temps que l’État mûrisse dans sa manière de gérer les problèmes et ne cèdent pas à la pression ou lobby de quelques individus mentalement réduits ou jas bene. Comme dans tout management, la France doit être agile et accompagner les éleveurs non pas dans la bêtise ou la facilité mais dans des mesures sensées. Prendre le problème à la racine !";Défavorable
AVIS FAVORABLE !, le 15 novembre 2023 à 22h07;"AVIS FAVORABLE !. Bien sur qu’il faut réguler le loup comme toutes les espèces qui se développent à outrance en menaçant les activités humaines ! que la limite soit à NOMBRE , NOMBRE , NOMBRE loups il faudra limiter à un moment donné et ceux qui s’y opposent aujourd’hui s’y opposeront à n’importe quel moment puisque leur ""problème"" est qu’ils ne peuvent pas supporter qu’un humain tue un animal alors cessons de les écouter pour assurer la sécurité des animaux domestiques et celles des habitants de nos campagnes.";Favorable
Avis favorable , le 15 novembre 2023 à 22h09;Avis favorable . Ils ne s’agit pas de massacrer tous les loups mais de limiter leur population pour que les gens puissent vivre en sécurité, eux et leurs troupeaux et animaux domestiques et de compagnie…;Favorable
Oui à ces nouvelles mesures, le 15 novembre 2023 à 22h14;Oui à ces nouvelles mesures. Oui à ces mesures qui même si elles ne manqueront pas de se montrer vite insuffisante pour maintenir un seuil de population viable pour les humains qui vivent dans les régions de développement des meutes. Le dialogue ne devrait pas être ouvert aux personnes se subissant pas les risques liés à la surpopulation des loups.;Favorable
Avis défavorable , le 15 novembre 2023 à 20h16;Avis défavorable . L’absence de progrès palpable depuis le dernier plan national d’action, malgré une multiplication des tirs létaux, frise le ridicule. Consultez l’avis du CNPN (Conseil National de la Protection de la Nature) pour éclairer la manière dont l’État présente ses projets pour avis, entre autres choses. Il faut indiscutablement aider les éleveurs (et seulement eux, noter que par exemple les mesures de protection sont accessibles à tous les agriculteurs enregistrés à la MAS et disposant du minimum de moutons requis) et les tirs dérogatoires justifiés sont parfois nécessaires fautes de mieux sur des troupeaux pourtant protégés (bergers, chiens, clôtures). Le risque zéro n’existe pas face à un prédateur. Une fois de plus, l’État semble s’incliner devant les lobbies les plus influents et continue de faire de l’affichage plutôt que d’être constructif.;Défavorable
FAVORABLE, le 16 novembre 2023 à 11h30;FAVORABLE. Les personnes qui sont pour les loups paient les dégâts de leur poches . Et non aux contribuables……;Favorable
Défavorable, le 16 novembre 2023 à 11h10;Défavorable. Tuer des loups est un moyen simple de calmer les éleveurs qui souffrent de problèmes bien plus graves : concurrence des viandes importées, prix des énergies, baisse de la consommation de viande, maladies…etc. Ces tueries lupines ne servent à rien, bien au contraire : elles désorganisent des meutes localisées et lancent dans les campagnes des loups esseulés beaucoup plus dangereux pour les animaux domestiques. Depuis septembre NOMBRE l’Espagne ne chasse plus les loups alors que ce pays abrite la plus forte population d’Europe de l’ouest.;Défavorable
Favorable, le 16 novembre 2023 à 11h04;"Favorable. C’est juste une affaire de bon sens ; les éleveurs doivent pouvoir exercer leurs activités pastorales sereinement : cela passe par le cantonnement du loup aux zones totalement sauvages et par sa régulation drastique ailleurs. Faudra-il attendre des victimes humaines la férocité de ces fauves n’est pas qu’une légende pour que les ""écologistes"" de salon prennent conscience de leur absence totale de discernement? Le militantisme n’a en aucun cas valeur d’expertise !";Favorable
CONTRE, le 16 novembre 2023 à 11h02;CONTRE. Apaisons les conflits homme – loup Ce grand prédateur n’a pas d’autre prédateur à part l’homme (autre grand prédateur). Mais comme à son accoutumé l’Homme veut maitriser la nature et la biodiversité, pour un point de vue économique. Le loup est un grand amateur d’ongulés sauvages comme les chevreuils, les chamois et les mouflons. Alors, il serait sans doute nécessaire de revoir le quota de chasse aux gros gibiers dans les endroits où le loup est le plus présent (évidemment il faudrait que nos amis les chasseurs soient favorables, et ça, ça n’est pas gagné). Aider et faciliter les éleveurs à protéger leurs troupeaux, en créant des postes jeunesses ou de réinsertion (dans la fonction publique) pour une durée par ex d’une année. Après des stages et formations de découverte du pastoralisme et de sensibilisation, ils participeraient à la surveillance des ovins ou caprins et aux diverses tâches propres à la protection du cheptel comme le regroupement des animaux la nuit et dans les interventions d’urgences (activités de surveillance, d’effarouchement, de recherche et de tri des animaux entre autres) et prendre part aux chantiers d’aménagement pastoraux. De plus, l’État doit prendre part à des chantiers de création ou rénovation d’ouvrages et équipements pastoraux. Ces chantiers ont pour objectif de rendre plus efficaces les pratiques de pâturage et de rendre le bétail moins vulnérable. Certaines de ces opérations peuvent être menées en collaboration avec d’autres acteurs institutionnels ou associatifs impliqués autour de cette thématique. Ensemble, agissons sans destruction systématique.;Défavorable
Avis défavorable , le 16 novembre 2023 à 10h53;Avis défavorable . Tuer les loups ne fera que le bonheur des agités de la gâchette ,mais sûrement pas celui des éleveurs car le malaise agricole est réel en France et le loup n’est pas le responsable. Mais comme en France le gouvernement est dirigé par les lobbies les problèmes ne sont pas prêts d’être résolus !;Défavorable
Défavorable , le 16 novembre 2023 à 13h08;Défavorable . Le tir n’est pas la solution aux attaques de troupeaux . Les pays frontaliers Espagne et Italie se sont adaptés à la présence du loup.;Défavorable
Toujours plus de barbarie , le 16 novembre 2023 à 13h07;"Toujours plus de barbarie . Après les sangliers, les chevreuils, les oiseaux ; les chausseurs s’attaquent à une nouvelle espèce, c’est une honte de prôner le massacre d’animaux pour le plaisir de certains qui ont besoin de tirer leur coup. Jusqu’où ira votre massacre de la faune ?";Défavorable
Défavorable !! , le 16 novembre 2023 à 13h07;Défavorable !! . Le loup constitue un élément incontournable de la biodiversité, il nous incombe de nous adapter à lui et non pas l inverse !;Défavorable
Défavorable, le 16 novembre 2023 à 13h02;Défavorable. Cet arrêté prévoit essentiellement de faciliter les destructions légales de loups par rapport aux précédents arrêtés. Or, les plafonds de destruction légale de loups sont atteints chaque année. Dès lors, on ne voit pas trop l’intérêt de faciliter les tirs, à part d’atteindre le plafond de destruction en juin. Et après, que fera-on ? L’avis du CNPN est par ailleurs clair, la gestion du loup en tant qu’espèce protégée en France manque clairement d’ambition. Le quatuor, comptage - tir - protection - indemnisation commence à avoir fait son temps.;Défavorable
Défavorable , le 16 novembre 2023 à 12h59;Défavorable . Le loup est nécessaire au bon équilibre de la biodiversité. Ce n’est pas un animal dangereux pour l’être humain. Il n’est pas utile de les tuer.;Défavorable
Défavorable , le 16 novembre 2023 à 13h01;Défavorable . Le loup n’a jamais attaqué l’homme. Dans nos pays voisins, notamment l’Italien et la Suisse, il n’y a aucun problème de cohabitation car l’homme a su s’adapter;Défavorable
Arrêtez ces massacres , le 16 novembre 2023 à 13h01;Arrêtez ces massacres . Bonjour, je suis contre les abattages de loups et d’espèces en général. Laissons la nature reprendre ses droits;Défavorable
Avis défavorable, le 16 novembre 2023 à 11h51;"Avis défavorable. Le loup est un élément essentiel de la chaîne alimentaire. L’espèce est en train de revenir spontanément sur les territoires qui avaient été les siens depuis des milliers d’années. A ce titre elle doit être protégée. Le ""seuil de viabilité"" démographique de l’espèce annoncé à "" NOMBRE loups"" est parfaitement arbitraire et sans aucun fondement scientifique pour cette espèce dont la survie dépend de la stabilité des groupes familiaux qui fondent sa vie sociale et non pas d’un ""nombre d’individus"". Il est absurde de vouloir comptabiliser dans un même total des adultes reproducteurs, des jeunes au sein d’une meute et des subadultes isolés en phase de dispersion qui auront un impact sur le milieu très différent et un poids démographique très inégal. Cette approche simpliste purement administrative par seuil d’effectif et par quotas de tir est infondée biologiquement. On ne peut pas d’autre part à la fois déplorer la prolifération des sangliers ou des chevreuils et se priver de leur principal prédateur, le loup, qui assure à lui seul une véritable régulation au sein de nos écosystèmes. Les déprédations sur les troupeaux du fait des loups existent naturellement, mais elles sont à ce jour beaucoup moins importantes que celles dues aux chiens en divagation. On n’a pourtant jamais imaginé instaurer des protocoles de tirs létaux sur les chiens responsables. Pourquoi le faire sur une espèce protégée autochtone dont l’impact est numériquement bien moindre ? De plus, il a été particulièrement bien documenté que les déprédations occasionnées par les loups augmentaient dans le cas de : - troupeaux mal protégés - zones de nouvelle occupation territoriale par de jeunes loups subadultes isolés - meutes déstructurées par des prélèvements (tirs létaux) ou des mortalités parmi leurs membres. Les loups survivants choisissent alors de se rabattre sur le cheptel domestique, faute de disposer de l’expertise et de l’effectif suffisants pour mener des chasses collectives sur des proies sauvages. La réponse la plus rationnelle et la plus efficace au problème des déprédations sur troupeaux est une meilleure protection des troupeaux (les méthodes les plus performantes sont aujourd’hui bien connues) et le respect de la stabilité démographique des meutes qui peuvent ainsi continuer à chasser les proies sauvages qui forment l’essentiel de leur régime alimentaire. L’approche proposée dans la modification du PIN sera non seulement inefficace, mais elle se révélera probablement contraire à terme à l’intérêt des éleveurs qu’elle est censée préserver. Elle doit être entièrement revue sur des bases scientifiques et non sur des ressentis appelant une approche simpliste et avant tout politique.";Défavorable
Maria Moritz, le 16 novembre 2023 à 13h07;Maria Morio. Contre l’abattage des loups ! Jusqu’à quand ce massacre va durer? Les chasseurs ne régulent absolument rien. D’ailleurs c’est interdit dans les pays voisins.;Défavorable
NON aux dérogations préjudiciables aux loups, le 16 novembre 2023 à 11h52;NON aux dérogations préjudiciables aux loups. Pourquoi sembler ignorer l’avis défavorable du CNPN au vu des conclusions du Plan National Loups NOMBRE - NOMBRE , parues en juillet NOMBRE et qui relève l’absence d’indicateurs pour procéder à une véritable évaluation, et pourquoi sembler ignorer que le loup est strictement protégé au niveau européen ( dans la convention de Berne relative à la vie sauvage et à la conservation des milieux naturels de l’Europe et dans la directive Habitats Faune Flore) ? Il ne faut pas accorder de dérogations aux interdictions de destructions de loups. Il existe des moyens largement étudiés de cohabiter les élevages avec les loups. Refuser les mesures qui ne font qu’aggraver l’effondrement du monde sauvage.;Défavorable
